Link,Year,Author,Journal,Title,Strategies,Frequency dependence,Payoffs,Penalties,Availability,Resources,Risks,Conditions,Access,Focus,Outcome
sci-hub.st/http://dx.doi.org/10.1016/S0003-3472(81)80117-0,1981,"Barnard, CJ; Sibly, RM",Animal Behaviour,Producers And Scroungers - A General-Model And Its Application To Captive Flocks Of House Sparrows,"Producers, scroungers","Frequency of strategies, group size","Amount of any particular resource, eg. mealworm capture rate","Competition, intereference at high density",,"Nests, food, mates. For the house sparrows, mealworms",,,,,Model predicts that groups will reach an evolutionary equilibrium when the payoff to producers and scroungers is equal. Group stability will depend on the ratio of producers to scroungers.
sci-hub.st/http://dx.doi.org/10.1086/285197,1991,"Vickery, WL; Giraldea, LA; Templeton, JJ; Kramer, DL; Chapman, CA",American Naturalist,"Producers, Scroungers, And Group Foraging","Producers, scroungers, opportunists","Effective group size, patch discovery rate decreased with less producers, scrounger's portion decreases with more scroungers","Scarce patches of divisible food items, finder's share, long search time relative to patch exploitation time",,Scarce patches of divisible food items,,,"Reduction of sensory contact between individuals, eg. wind or fog, likely reduces group size and favors increased proportion of producers","Assumed that producers have a finder's share before scroungers and opportunities arrive at the patch. The remainder is divided equally between the producer and all scroungers (including opportunists), where the total consumed by scroungers is the scrounger's share.",Reconcile information-sharing and producer-scrounger models of group foraging,"These three strategies can only coexist when opportunist's loss in searching ability is exactly equal to its gain in scrounging ability. All pairs of strategies can coexist, depending on relative producing ability and relative scrounging ability of opportunists and the finder's share."
https://sci-hub.st/10.1016/S0022-5193(05)80156-0,1991,Caraco T; Giraldeau L-A,Journal Of Theoretical Biology,Social Foraging Producing And Scrounging In A Stochastic Environment,,Producer-priority model assumes producer's intake does not depend on the number of scroungers whereas scramble-competition model assumes producer's intake decreases with the number of scroungers,,,Scramble competition and producer priority modells,,,,Random patch size and random allocation of food items to each forager at a patch.,,Producer-priority models show scrounging reduces producer's food intake but does not depend on the number of scroungers in the group. Scramble competition models show producer's food intake decreases with the number of scroungers
sci-hub.st/http://dx.doi.org/10.1006/anbe.1996.0014,1996,"Ranta, E; Peuhkuri, N; Laurila, A; Rita, H; Metcalfe, NB",Animal Behaviour,"Producers, Scroungers And Foraging Group Structure","Producers, scroungers",,"Finder's share, intake rate and competitive ability",,,,,,,Model which a;llows individuals to differ in food-finding ability and competitive ability once food is found,Scroungers tolerated given predator vigilance while scrounging and dilution effect
sci-hub.st/http://dx.doi.org/10.1007/s002650050313,1997,"Rita, H; Ranta, E; Peuhkuri, N",Behavioral Ecology And Sociobiology,"Group Foraging, Patch Exploitation Time And The Finder'S Advantage",,,,,,,,,,,A producer should leave a patch earlier than scroungers if the producer has a finder's advantage. More producers in a group results in finding more patches
sci-hub.st/http://dx.doi.org/10.2307/5920,1997,"Beauchamp, G; Belisle, M; Giraldeau, LA",Journal Of Animal Ecology,Influence Of Conspecific Attraction On The Spatial Distribution Of Learning Foragers In A Patchy Habitat,"Producers, scroungers. Producers show no conspecific attraction while scroungers would show conspecific attraction",Scrounger payoffs expected to decrease with increasing scrounger frequency in population,"For the ideal free distribution model, payoffs are equal for all individuals given the distribution of group sizes according to patch quality",,,"Two types of habitats: patches with large number of food items that are not depletable, patches that are quickly depleted",,,Travel costs induce foragers to become more sedentary,"Compare the ideal free distribution model, a model with travel costs and a model with travel costs and conspecific attraction",Interference reduced the average intake rate and increased variation in intake rate across foragers
sci-hub.st/http://dx.doi.org/10.1006/anbe.1997.0649,1998,"Ranta, E; Peuhkuri, N; Hirvonen, H; Barnard, CJ",Animal Behaviour,"Producers, Scroungers And The Price Of A Free Meal","Producers, scroungers",,,,,,Predation,,Finder's share,Differences between producers and scroungers in vigilance level and vulnerability to predators. ESS group combinations of producer and scrounger strategies,"Scroungers contribute to group vigilance, and therefore pay for their ""free meal"""
sci-hub.st/http://dx.doi.org/10.1007/s002650050433,1998,"Barta, Z; Giraldeau, LA",Behavioral Ecology And Sociobiology,The Effect Of Dominance Hierarchy On The Use Of Alternative Foraging Tactics: A Phenotype-Limited Producing-Scrounging Game,"Producers, scroungers",,Intake rate,,,,,,"Priority access to resources depending on dominance rank. After finder's share, remainder divided among scroungers.",How differences in dominance influence individual's decision to play producer or scrounger,"As finder's share increases, proportion of scroungers decreases. At similar dominance ranks, individuals should all equally play scrounger. At asymmetrical dominance ranks, superior individuals should use mostly scrounging while inferior individuals should use mostly producing. Only when competitive differences are very large, eg. a dominant individual can monopolize the whole or most of a patch, should individuals specialize exclusively in one role (dominants - scrounge, subordinates - produce)"
sci-hub.st/http://dx.doi.org/10.2307/3546372,1998,"Rita, H; Ranta, E",Oikos,"Group Foraging, Gain And The Finder'S Advantage","Producers, scroungers",,"The larger the finder's share, the more the payoff resembles the payoff for a solitary finder",,,,,,,Accumulation of gain from producer's share,"Within and between patch components of gain variance are larger for producers in groups with scroungers (assuming scroungers are less skilled foragers). If foragers are risk-averse, favoring to minimize variance, we should expect patch-finding skill assorted foraging groups"
sci-hub.st/http://dx.doi.org/10.1086/303342,2000,"Barta, Z; Giraldeau, LA",American Naturalist,Daily Patterns Of Optimal Producer And Scrounger Use Under Predation Hazard: A State-Dependent Dynamic Game Analysis,"Producers, scroungers",,"When scrounging is rare, it is assumed to do better than the producer alternative because it can take advantage of the many exploitable food patches discovered by the producers. When scrounging is common, the number of individuals competing as scroungers increases and the payoffs for scroungers declines. Survival probability is the currency used here instead of net food intake to determine how the use of either strategy impacts individuals' survival probability",The nighttime non foraging period reduces animal's energy reserves that are replenished during daylight. Foraging increases risk of predation while resting decreases risk of predation while consuming energy,,,"Predation / hazard risk. Scroungers surveying for producers finding patches also provides a lower predation hazard as a by-product and to include this, the authors set the predation hazard for scroungers to half that of the  producers.",,All scroungers get equal access to each producer's patch minus the producer's share. Patch-finding rate and amount of food in a patch were constant. Varying patchiness did not change the average daily stable proportion of scrounging but increasing patchiness decreased the probability of survival in most cases.,"State-dependent dynamic producer-scrounger game that predicts early in the day when energy reserves are low, individuals will prefer the scrounger strategy. Late in the day, individuals will favor the producer strategy. Under rich and clumped food, scrounging will improve daily survival of all group members.","The proportion of individuals scrounging is predicted to change through the day, highest around dawn and dusk and lowest around midday because the scrounger obtains small amounts of food in a reliable way while the producer either acquires high or no food intake. Producing is optimal in midday if individuals are near or above their critical reserve level because if a producer is successful they are likely able to switch to resting sooner and avoid predation hazard."
sci-hub.st/http://dx.doi.org/10.1006/jtbi.2000.2153,2000,"Beauchamp, G",Journal Of Theoretical Biology,Learning Rules For Social Foragers: Implications For The Producer-Scrounger Game And Ideal Free Distribution Theory,"Producers, scroungers",,,Movement cost. Scroungers would move to the nearest exploited patch at a speed of two locations per time step instead of one since they were not limited by concurrently searching for food,Patches were depletable,,,,,Learning rules for social foraging in the ideal free distribution and producer-scrounger dynamics,"Scrounging is less likely in populations with fewer foragers and in habitats with poorer patches. Maximizing led to early divergence in tactic use and extreme use of one or the other tactic. When individuals had early foraging success, they were likely to continue using the same strategy. This could be problematic in highly variable environments or in situations where environments change significantly where an alternative strategy would otherwise be favored."
sci-hub.st/http://dx.doi.org/10.1093/beheco/12.2.121,2001,"Barta, Z; Giraldeau, LA",Behavioral Ecology,Breeding Colonies As Information Centers: A Reappraisal Of Information-Based Hypotheses Using The Producer-Scrounger Game,"Producers, scroungers representing searcher and wait-and-follower",,,,,,,,,,
sci-hub.st/http://dx.doi.org/10.1093/beheco/14.1.2,2003,"Dubois, F; Giraldeau, LA; Grant, JWA",Behavioral Ecology,Resource Defense In A Group-Foraging Context,"Producers, scroungers representing searcher and wait-and-follower",,Resources for scrounger are what remains minus finder's share,Energetic costs of fighting,,,,,,Reconcile differences between optimality approach used to predict economic defendability of resources and game theoretic approach,"Aggression should always decrease as the density and richness of food clumps increases. The dove is never an ESS. Some animals share food clumps without any overt aggression, and this may be due to iterated play among familiar players"
https://sci-hub.st/10.1093/beheco/ari063,2005,"Ruxton, Graeme D. (g.ruxton@bio.gla.ac.uk) ; Fraser, Chris; Broom, Mark",Behavioral Ecology,An Evolutionarily Stable Joining Policy For Group Foragers,,,,,,,,"Under limited sensory range, foragers may have difficulty detecting conspecifics that could also join the patch and decrease their share",,Evolutionarily stable joining strategy,"There should be a critical joining distance within which all opportunities should be accepted and beyond which opportunities should be rejected. The joining distance should increase with decreasing density of other foragers, increasing speed of movement, increasing difficulty in finding undiscovered food patches and decreasing speed of which discovered patches can be consumed.  Discovered patches are more heavily exploited when patches are hard to find, patches can be searched for remaining food more quickly, forager density is low and foragers are relatively slow in traveling to discovered patches"
sci-hub.st/http://dx.doi.org/10.1890/04-0566,2005,"Dubois, FD; Giraldeau, LA",Ecology,Fighting For Resources: The Economics Of Defense And Appropriation,"Producers, scroungers playing hawks, doves",,,"Energetic cost of fight, mean contest duration, density of predators, risk of being killed by a predator during an escalated fight","Patch density, patch richness",,Predation hazard,,,"How changes in group size, clump density, patch richness and predation hazards affect both decision to appropriate and defend a resource and interact to predict effects on the frequency of aggression and aggressiveness of individuals","Producer challenged by a scrounger should always aggressively defend clumps whereas only a fraction of scroungers should attempt to aggressively appropriate a producer's food. This is due to the finders share that lets producers pay more for defense than a scrounger can for appropriation.   Increasing group size will increase the rate of playing scrounger and increase the costs of aggression. Few scroungers are expected at the equilibrium when the number of foragers is small.   Increasing patch density will reduce the time required for producers to find patches and the temporal costs associated with aggressive appropriation will make scrounger less profitable. Encounters will decline as the number of producers increases.   Increasing patch richness will increase the scrounger's share and the proportion of scroungers within the group. Scroungers are more likely to get required food to offset expenses of aggressive appropriation.   Costs of aggression increase with predation pressure as the increased probability of being killed by a predator while engaged in a fight increase. Aggression should reduce when predation hazard increases but non-aggressive scroungers will be unsuccessful securing food from aggressive producers. Otherwise, scroungers are likely to switch to producing, reducing the proportion of scroungers and decreasing the number of challenges but with lower numbers of scroungers, the aggressiveness increases."
sci-hub.st/http://dx.doi.org/10.1007/s00265-007-0461-8,2007,"Dubois, F; Giraldeau, LA",Behavioral Ecology And Sociobiology,Food Sharing Among Retaliators: Sequential Arrivals And Information Asymmetries,"Producers, scroungers, retaliators playing hawk, dove, retaliator. Given asymmetric information, scrounger simply copies finder's choice of hawk or dove, to determine if patch is worth fighting for (using inadvertent social information Danchin_2004",,,,Uncertainty about patch richness,,,,,Modify Hawk-Dove game to allow finder the opportunity of retaliating if the joiners escalate and considering the consequences of information asymmetries concerning resource value among players,"Retaliator strategy predicts widespread sharing in habitats where food clumps are of intermediate richness. When information asymmetry between finder and joiner is created, conditions for sharing are even more easily met and apply to a wider range of resource qualities. This model offers one of the most parsimonious and potentially general evolutionary accounts of the origin of non-aggressive resource sharing. Sharing should be more common when resource heterogeneity leads to increased joiner uncertainty."
sci-hub.st/http://dx.doi.org/10.1016/j.jtbi.2009.06.002,2009,"Ohtsuka, Y; Toquenaga, Y",Journal Of Theoretical Biology,The Patch Distributed Producer-Scrounger Game,"Producers, scroungers",,"Energy intake, finder's share",,,,,,,Relaxe the assumption that only one patch is discovered in each time unit and allows multiple patches to be found depending on the the producers' encounter rate with patches,The frequency of producers strongly depends on the patch encounter rate although it still depends on the producer's advantage and group size. The proportion of scroungers increases when resources are spatiotemporally clumped and decrease when resources are evenly distributed
sci-hub.st/http://dx.doi.org/10.1093/beheco/arq069,2010,"Mathot, KJ; Giraldeau, LA",Behavioral Ecology,Within-Group Relatedness Can Lead To Higher Levels Of Exploitation: A Model And Empirical Test,"Producers, scroungers",,,"Aggression from producers towards scroungers, different depending on kin and nonkin",,,,,Differential tolerance towards scrounging by kin and nonkin,Do producers allow kin to scrounge more frequently?,"Model predicts increased relatedness can lead to higher levels of exploitation when producers are kin-selected to be more tolerant of scrounging from relatives compared with non relatives, eg. being more aggressive towards nonkin. Empirical tests in this study with zebra finches had higher frequencies of scrounging and lower levels of aggressive interactions when finches were related compared to when finches were unrelated."
sci-hub.st/http://dx.doi.org/10.1098/rspb.2010.0857,2010,"Dubois, F; Morand-Ferron, J; Giraldeau, LA",Proceedings Of The Royal Society B-Biological Sciences,Learning In A Game Context: Strategy Choice By Some Keeps Learning From Evolving In Others,"Producers, scroungers",Payoffs are highly negatively frequency-dependent such that scrounger do better than producers when scroungers are rare and scroungers do worse than producers when scroungers are common. Number of foragers in group.,"Patch quality, finder's share",,,Changing environments,,,Patch encounter rate,Whether a learning mutant that can optimize its use of producer and scrounger to local conditions can invade a population of non-learning individuals that play producer and scrounger with fixed probabilities,"Learning provides an initial advantage but never evolves to fixation. At a stable equilibrium, the population is made up of a majority of fixed players and a minority of learning players."
sci-hub.st/http://dx.doi.org/10.1051/mmnp/20149309,2014,"Broom, M; Rychtar, J; Sykes, D",Mathematical Modelling Of Natural Phenomena,Kleptoparasitic Interactions Under Asymmetric Resource Valuation,"Producers, scroungers",,Value of resources,Conflict cost,,,,Seasonal scarcity of resources leading to stealing when food is rare but not when food is common,"1 Scrounger does not attempt to steal, 2 scroungers attempts to steal and producer defends, 3 scrounger attempts to steal and producer does not defend",Model stealing interactions under asymmetric food valuation,"Differences between individuals in resource holding potential  affects their changes of winning a conflict and how much they value a particular resource. Strong effect of the relationship between resource holding potential and the value of resources on how much aggressive behaviour occurs in the population. This results in fights occurring mainly between strong individuals or between weak individuals. For example, if a weak individual is struggling to survive, it will attribute high value to the resource and fight where a strong individual will not defend."
sci-hub.st/http://dx.doi.org/10.1098/rspb.2014.1072,2014,"Kane, A; Jackson, AL; Ogada, DL; Monadjem, A; McNally, L",Proceedings Of The Royal Society B-Biological Sciences,Vultures Acquire Information On Carcass Location From Scavenging Eagles,"Producers, scroungers",,,,,,,,,Determine if there are interspecific producer scrounger dynamics between eagles and vultures.,Social information transfer can occur across species and ecosystem-based management is critical considering vulture populations suffering global declines
sci-hub.st/http://dx.doi.org/10.1007/s00285-014-0848-x,2015,"Broom, M; Johanis, M; Rychtar, J",Journal Of Mathematical Biology,The Effect Of Fight Cost Structure On Fighting Behaviour,"Producers, scroungers",,,"Individual choose to invest an amount of energy into contests and level of investment of each individual determines probability it will win contest, and additional cost it has to bear. Cost function either convex or concave",,,"Risk of injury or lost energy for convex cost functions, predation risk for concave cost functions",,,"Extend previous models that consider a discrete set of options for gaining resources eg. steal or not, or play hawk or dove in a contest, to consider a continuous measure of effort invested following a particular cost function.","For high levels of maximum investment, the producer keeps the resource without a fight for concave cost functions but for convex functions the scrounger obtains the resource at some cost."
https://sci-hub.st/https://www.sciencedirect.com/science/article/abs/pii/S1476945X15000446,2016,"Broom, M., Rychtář, J.",Ecological Complexity,A Model Of Food Stealing With Asymmetric Information,"Producers, scroungers",,"Information about food patch, finder's share","Energetic cost of contest, probability that producer will win contest",,,,,,Consider a producer scrounger game where the producer knows the value of the remaining food patch but the scrounger does not,"The extra information held by the producer can be both beneficial and harmful. Examples where information is not available to scrounger include resources not immediately visible eg. concealed nests, or where contest occurs quickly after the patch is discovered, not allowing sufficient time for producer to evaluate the patch.   Where costs of contests are high, or if joiner only has a small chance of winning the contest eg if the patch is easily defended, the producer should play hawk and the scrounger should play dove leaving the producer with the resource without contest.   When the scrounger's potential cost is small compared to the value of the food or if the scrounger's change of winning is high, the scrounger will always fight."
sci-hub.st/http://dx.doi.org/10.1098/rspb.2015.2550,2016,"Lee, AEG; Ounsley, JP; Coulson, T; Rowcliffe, JM; Cowlishaw, G",Proceedings Of The Royal Society B-Biological Sciences,Information Use And Resource Competition: An Integrative Framework,"Producers, scroungers",,Finder's share,,Individuals can search for resources alone or by using social information,"Depletion rate, distribution",,,"Monopolizability, social rank","Developed a model to demonstrate how competition can facilitate or constrain an individual's ability to use information when acquiring resources, considering resource distribution","Increasing the producer's resource discovery rate reduced the relative cost of solitary foraging. If patches were easy to find and individuals were unable to monopolize resources, scrounging became less common. Under conditions of strong monopolization and intermediate discovery rates, higher levels of scrounging occurred.   Two main predictions: 1 The effects of resource scarcity on social information use should depend on resource monopolizability. 2 The potential benefits of social dominance should be closely linked to social information use in uncertain environments.   There are constrains that competition imposes on an individual's ability to use social information to access resources. When resources are monopolizable, social information use may become exclusive to dominant individuals leading to a positive relationship between social rank and resource acquisition rate.    Selection pressures on dominance will depend on multidimensional aspects of resources eg. scarcity, depletion rate and monopolizability"
sci-hub.st/http://dx.doi.org/10.1098/rsos.160830,2017,"Toyokawa, W",Royal Society Open Science,Scrounging By Foragers Can Resolve The Paradox Of Enrichment,"Producers, scroungers",,,,,,,,,Predator population in which individuals play a producer scrounger game to analyse the stability of a coexisting equilibrium point in one prey system and non equilibrium dynamics in two prey system.,Social foraging can stabilize both one prey and two prey systems and resolve the paradox of enrichment when scrounging is prevalent in predators. Scrounging can lower the growth rate of a population allowing the prey resource to persist at higher densities than if scrounging was absent.
sci-hub.st/http://dx.doi.org/10.1007/s00285-017-1149-y,2018,"Broom, M; Johanis, M; Rychtar, J",Journal Of Mathematical Biology,The Effect Of Fight Cost Structure On Fighting Behaviour Involving Simultaneous Decisions And Variable Investment Levels,"Producers, scroungers",,Resource value,"The larger the investment effort, the larger the change of winning the resource but allso the larger the cost",,,,,,"Continuing from Broom_2016, consider now that the decision to invest are made simultaneously instead of sequentially first with the scrounger and second with the producer's response",Some different results from Broom_2016 due to simultaneous play
