Authors,Title,Year,Source title,DOI,Link,Open Access
"Luthra M., Todd P.M.","Social search and resource clustering as emergent stable states",2023,"Artificial Life","10.1162/artl_a_00391","https://www.scopus.com/inward/record.uri?eid=2-s2.0-85147317766&doi=10.1162%2fartl_a_00391&partnerID=40&md5=21b4c96be78b36b3343eb82ba1bfb39f",""
"Parthasarathy B., Dumke M., Herberstein M.E., Schneider J.M.","Male cooperation improves their own and kin-group productivity in a group-foraging spider",2023,"Scientific Reports","10.1038/s41598-022-27282-9","https://www.scopus.com/inward/record.uri?eid=2-s2.0-85145835763&doi=10.1038%2fs41598-022-27282-9&partnerID=40&md5=545c030d07331882495bb3f4627c52a8","All Open Access, Gold, Green"
"Xue Z., Yu J., Zhao A., Zong Y., Yang S., Wang M.","Optimal chiller loading by improved sparrow search algorithm for saving energy consumption",2023,"Journal of Building Engineering","10.1016/j.jobe.2023.105980","https://www.scopus.com/inward/record.uri?eid=2-s2.0-85147017977&doi=10.1016%2fj.jobe.2023.105980&partnerID=40&md5=76c66895bd64ca9588842c35eb8a67f4",""
"Chen Y., Li Z.","Asymptotic behavior in a forager-exploiter model with nonlinear resource consumption with/without general logistic sources",2023,"Journal of Mathematical Analysis and Applications","10.1016/j.jmaa.2022.126793","https://www.scopus.com/inward/record.uri?eid=2-s2.0-85140061707&doi=10.1016%2fj.jmaa.2022.126793&partnerID=40&md5=80a4164557958cbb5ace3c3336edc58c",""
"Xu H., Wang L.","Global existence and asymptotic stability of solutions to a forager–exploiter model with logistic source",2023,"Zeitschrift fur Angewandte Mathematik und Physik","10.1007/s00033-022-01900-y","https://www.scopus.com/inward/record.uri?eid=2-s2.0-85143135270&doi=10.1007%2fs00033-022-01900-y&partnerID=40&md5=904c847efc8da669d91a803d72e18a9c",""
"Nöbel S., Jacquet A., Isabel G., Pocheville A., Seabright P., Danchin E.","Conformity in mate choice, the overlooked social component of animal and human culture",2023,"Biological Reviews","10.1111/brv.12899","https://www.scopus.com/inward/record.uri?eid=2-s2.0-85138985403&doi=10.1111%2fbrv.12899&partnerID=40&md5=298ef5b3bf05f029d3c6afa5a6223229",""
"Chen Q., Chen G., Shao M., Wu Y., Wang J., Wan D., Yin J.","Social experience promotes the exploratory behaviour in Java Sparrows",2023,"Avian Research","10.1016/j.avrs.2023.100087","https://www.scopus.com/inward/record.uri?eid=2-s2.0-85148765727&doi=10.1016%2fj.avrs.2023.100087&partnerID=40&md5=a47b98a390d9967f49eeeb32476263d9","All Open Access, Gold"
"Ioannou C.C., Laskowski K.L.","Conformity and differentiation are two sides of the same coin",2023,"Trends in Ecology and Evolution","10.1016/j.tree.2023.01.014","https://www.scopus.com/inward/record.uri?eid=2-s2.0-85148716625&doi=10.1016%2fj.tree.2023.01.014&partnerID=40&md5=da4e261e47ff1a2270923836b22d527b","All Open Access, Hybrid Gold"
"Tao Y., Winkler M.","Small-signal solutions to a nonlocal cross-diffusion model for interaction of scroungers with rapidly diffusing foragers",2023,"Mathematical Models and Methods in Applied Sciences","10.1142/S0218202523500045","https://www.scopus.com/inward/record.uri?eid=2-s2.0-85147108501&doi=10.1142%2fS0218202523500045&partnerID=40&md5=414f695bc067c95daf9f5aa5cc2a50c3",""
"Bagwell J.N.","Debunking interface theory: why Hoffman’s skepticism (really) is self-defeating",2023,"Synthese","10.1007/s11229-022-04021-1","https://www.scopus.com/inward/record.uri?eid=2-s2.0-85146822406&doi=10.1007%2fs11229-022-04021-1&partnerID=40&md5=8d63ba36781149368478a87b03f668cf",""
"Yu W., Kang H., Sun G., Liang S., Li J.","Bio-Inspired Feature Selection in Brain Disease Detection via an Improved Sparrow Search Algorithm",2023,"IEEE Transactions on Instrumentation and Measurement","10.1109/TIM.2022.3228003","https://www.scopus.com/inward/record.uri?eid=2-s2.0-85144806618&doi=10.1109%2fTIM.2022.3228003&partnerID=40&md5=4faf1b0f79a3e3eb3e3b0767c291bc2b",""
"de Groot C., Wijnhorst R.E., Ratz T., Murray M., Araya-Ajoy Y.G., Wright J., Dingemanse N.J.","The importance of distinguishing individual differences in ‘social impact’ versus ‘social responsiveness’ when quantifying indirect genetic effects on the evolution of social plasticity",2023,"Neuroscience and Biobehavioral Reviews","10.1016/j.neubiorev.2022.104996","https://www.scopus.com/inward/record.uri?eid=2-s2.0-85144440766&doi=10.1016%2fj.neubiorev.2022.104996&partnerID=40&md5=c605bc4212beada36b2fe3de62079c88",""
"Akhand M.A.H., Rahman M.M., Siddique N.","Advances on Particle Swarm Optimization in Solving Discrete Optimization Problems",2023,"Studies in Computational Intelligence","10.1007/978-3-031-09835-2_4","https://www.scopus.com/inward/record.uri?eid=2-s2.0-85139383034&doi=10.1007%2f978-3-031-09835-2_4&partnerID=40&md5=3f9dfbca6e5f32d7bd1659a37cf3518e",""
"Beauchamp G., Bowman R.","Visual Monitoring Strategies of Sentinels in a Cooperative Breeder",2022,"Biology","10.3390/biology11121769","https://www.scopus.com/inward/record.uri?eid=2-s2.0-85144915288&doi=10.3390%2fbiology11121769&partnerID=40&md5=c7549f827384414f11bbcd4866f23d8b","All Open Access, Gold, Green"
"Hong Z.","Combining Conformist and Payoff Bias in Cultural Evolution: An Integrated Model for Human Decision-Making",2022,"Human Nature","10.1007/s12110-022-09435-x","https://www.scopus.com/inward/record.uri?eid=2-s2.0-85143906721&doi=10.1007%2fs12110-022-09435-x&partnerID=40&md5=18fa9648cb314f25e29b238572e8af14",""
"Hong J., Shen B., Xue J., Pan A.","A vector-encirclement-model-based sparrow search algorithm for engineering optimization and numerical optimization problems",2022,"Applied Soft Computing","10.1016/j.asoc.2022.109777","https://www.scopus.com/inward/record.uri?eid=2-s2.0-85142128220&doi=10.1016%2fj.asoc.2022.109777&partnerID=40&md5=60df666d8a02e4bf1b027eba203b0dd5",""
"Duran-Nebreda S., O’Brien M.J., Bentley R.A., Valverde S.","Dilution of expertise in the rise and fall of collective innovation",2022,"Humanities and Social Sciences Communications","10.1057/s41599-022-01380-5","https://www.scopus.com/inward/record.uri?eid=2-s2.0-85139801872&doi=10.1057%2fs41599-022-01380-5&partnerID=40&md5=19de80eba258a532aef768f9ed998477","All Open Access, Gold, Green"
"Yao G., Wang J., Cui B., Ma Y.","Quantifying effects of tasks on group performance in social learning",2022,"Humanities and Social Sciences Communications","10.1057/s41599-022-01305-2","https://www.scopus.com/inward/record.uri?eid=2-s2.0-85137071771&doi=10.1057%2fs41599-022-01305-2&partnerID=40&md5=266b9729bf58763557d962f6ed443ed3","All Open Access, Gold"
"Kohles J.E., O'Mara M.T., Dechmann D.K.N.","A conceptual framework to predict social information use based on food ephemerality and individual resource requirements",2022,"Biological Reviews","10.1111/brv.12881","https://www.scopus.com/inward/record.uri?eid=2-s2.0-85135492315&doi=10.1111%2fbrv.12881&partnerID=40&md5=9d99cc5be07a0a3ac24d6328a2a6bc03","All Open Access, Green"
"Duan M., Yang Z., Zhao Y., Fang L., Zuo H., Li Z., Wang D.","Wavefront shaping using improved sparrow search algorithm to control the scattering light field",2022,"Optics and Laser Technology","10.1016/j.optlastec.2022.108529","https://www.scopus.com/inward/record.uri?eid=2-s2.0-85135403059&doi=10.1016%2fj.optlastec.2022.108529&partnerID=40&md5=c0b635a053fad25400c2c30613986ef9",""
"Dorfman A., Hills T.T., Scharf I.","A guide to area-restricted search: a foundational foraging behaviour",2022,"Biological Reviews","10.1111/brv.12883","https://www.scopus.com/inward/record.uri?eid=2-s2.0-85133895414&doi=10.1111%2fbrv.12883&partnerID=40&md5=91bd2eca9fc0f1a587e5f8deb03897ac","All Open Access, Hybrid Gold, Green"
"Šlipogor V., Graf C., Massen J.J.M., Bugnyar T.","Personality and social environment predict cognitive performance in common marmosets (Callithrix jacchus)",2022,"Scientific Reports","10.1038/s41598-022-10296-8","https://www.scopus.com/inward/record.uri?eid=2-s2.0-85129401705&doi=10.1038%2fs41598-022-10296-8&partnerID=40&md5=75f5d93808ee40dc39fd7ad3dfe6715b","All Open Access, Gold, Green"
"Todd C.M., Westcott D.A., Martin J.M., Rose K., McKeown A., Hall J., Welbergen J.A.","Body-size dependent foraging strategies in the Christmas Island flying-fox: implications for seed and pollen dispersal within a threatened island ecosystem",2022,"Movement Ecology","10.1186/s40462-022-00315-8","https://www.scopus.com/inward/record.uri?eid=2-s2.0-85128222380&doi=10.1186%2fs40462-022-00315-8&partnerID=40&md5=3a87d4af85b5f7eab08da28b21be04b6","All Open Access, Gold, Green"
"McCune K.B., Valente J.J., Jablonski P.G., Lee S.-I., Ha R.R.","Social behavior mediates the use of social and personal information in wild jays",2022,"Scientific Reports","10.1038/s41598-022-06496-x","https://www.scopus.com/inward/record.uri?eid=2-s2.0-85124680277&doi=10.1038%2fs41598-022-06496-x&partnerID=40&md5=a6a67d3867d4913b50d11e0fe2364a94","All Open Access, Gold, Green"
"Nakawake Y., Kobayashi Y.","Negative observational learning might play a limited role in the cultural evolution of technology",2022,"Scientific Reports","10.1038/s41598-022-05031-2","https://www.scopus.com/inward/record.uri?eid=2-s2.0-85123093256&doi=10.1038%2fs41598-022-05031-2&partnerID=40&md5=debcb7d28683669c9d35bbd584466273","All Open Access, Gold, Green"
"Bracken A.M., Christensen C., O’Riain M.J., Fehlmann G., Holton M.D., Hopkins P.W., Fürtbauer I., King A.J.","Socioecology Explains Individual Variation in Urban Space Use in Response to Management in Cape Chacma Baboons (Papio ursinus)",2022,"International Journal of Primatology","10.1007/s10764-021-00247-x","https://www.scopus.com/inward/record.uri?eid=2-s2.0-85117248088&doi=10.1007%2fs10764-021-00247-x&partnerID=40&md5=c5aac6e0c10b16f7c4b17cef42bff65b","All Open Access, Hybrid Gold, Green"
"Vidiella B., Carrignon S., Bentley R.A., O'Brien M.J., Valverde S.","A cultural evolutionary theory that explains both gradual and punctuated change",2022,"Journal of the Royal Society Interface","10.1098/rsif.2022.0570","https://www.scopus.com/inward/record.uri?eid=2-s2.0-85141951895&doi=10.1098%2frsif.2022.0570&partnerID=40&md5=2c03de2758caa690974e687476dbf852","All Open Access, Hybrid Gold, Green"
"Morgan T.J.H., Suchow J.W., Griffiths T.L.","The experimental evolution of human culture: Flexibility, fidelity and environmental instability",2022,"Proceedings of the Royal Society B: Biological Sciences","10.1098/rspb.2022.1614","https://www.scopus.com/inward/record.uri?eid=2-s2.0-85141220479&doi=10.1098%2frspb.2022.1614&partnerID=40&md5=908679b6ddb60bb7d59aa7d593281bf9",""
"Ai X., Li S., Xu H.","Short-term wind speed forecasting based on two-stage preprocessing method, sparrow search algorithm and long short-term memory neural network",2022,"Energy Reports","10.1016/j.egyr.2022.11.051","https://www.scopus.com/inward/record.uri?eid=2-s2.0-85141917242&doi=10.1016%2fj.egyr.2022.11.051&partnerID=40&md5=765e8c4487fce30ab29bb1a706b953c6","All Open Access, Gold"
"Malone M.A., Polivka C.M.","The behavioural ecology toolkit for fish management and conservation",2022,"Fish and Fisheries","10.1111/faf.12707","https://www.scopus.com/inward/record.uri?eid=2-s2.0-85138753299&doi=10.1111%2ffaf.12707&partnerID=40&md5=127ab170cc78cbbba8177239281b862e",""
"Bentley P.J., Lim S.L.","From evolutionary ecosystem simulations to computational models of human behavior",2022,"Wiley Interdisciplinary Reviews: Cognitive Science","10.1002/wcs.1622","https://www.scopus.com/inward/record.uri?eid=2-s2.0-85138159232&doi=10.1002%2fwcs.1622&partnerID=40&md5=673f00c3ad06ae0d78823b33b5ad8e2b","All Open Access, Hybrid Gold, Green"
"Chen Y., Li Z.","Boundedness and stabilization in a quasilinear forager–exploiter model with volume-filling effects",2022,"Zeitschrift fur Angewandte Mathematik und Physik","10.1007/s00033-022-01821-w","https://www.scopus.com/inward/record.uri?eid=2-s2.0-85134671863&doi=10.1007%2fs00033-022-01821-w&partnerID=40&md5=33b1e9374316d251925434b35f2ff99d",""
"Wright J., Haaland T.R., Dingemanse N.J., Westneat D.F.","A reaction norm framework for the evolution of learning: how cumulative experience shapes phenotypic plasticity",2022,"Biological Reviews","10.1111/brv.12879","https://www.scopus.com/inward/record.uri?eid=2-s2.0-85133311433&doi=10.1111%2fbrv.12879&partnerID=40&md5=c6e70d6fd8ec66352363352f7100f657","All Open Access, Green"
"Hämäläinen L., M. Rowland H., Mappes J., Thorogood R.","Social information use by predators: expanding the information ecology of prey defences",2022,"Oikos","10.1111/oik.08743","https://www.scopus.com/inward/record.uri?eid=2-s2.0-85121387065&doi=10.1111%2foik.08743&partnerID=40&md5=abb8099e233721b6e729eef5409b1eb1","All Open Access, Green"
"Shultz S., Dunbar R.I.M.","Socioecological complexity in primate groups and its cognitive correlates",2022,"Philosophical Transactions of the Royal Society B: Biological Sciences","10.1098/rstb.2021.0296","https://www.scopus.com/inward/record.uri?eid=2-s2.0-85135553131&doi=10.1098%2frstb.2021.0296&partnerID=40&md5=d5e9f18fded4ef1e8673c52c7877e7e4","All Open Access, Hybrid Gold, Green"
"Stanton L.A., Bridge E.S., Huizinga J., Benson-Amram S.","Environmental, individual and social traits of free-ranging raccoons influence performance in cognitive testing",2022,"Journal of Experimental Biology","10.1242/jeb.243726","https://www.scopus.com/inward/record.uri?eid=2-s2.0-85138359162&doi=10.1242%2fjeb.243726&partnerID=40&md5=894fd8a06f97755186eb77fc82b11484","All Open Access, Hybrid Gold, Green"
"Freeberg T.M., Coppinger B.A.","Social contextual influences on behaviour",2022,"The Routledge International Handbook of Comparative Psychology","10.4324/9781003091868-28","https://www.scopus.com/inward/record.uri?eid=2-s2.0-85138107401&doi=10.4324%2f9781003091868-28&partnerID=40&md5=bdc3c23b9f01dcdaaee24c510a4c4838",""
"Fagan W.F., Saborio C., Hoffman T.D., Gurarie E., Cantrell R.S., Cosner C.","What’s in a resource gradient? Comparing alternative cues for foraging in dynamic environments via movement, perception, and memory",2022,"Theoretical Ecology","10.1007/s12080-022-00542-0","https://www.scopus.com/inward/record.uri?eid=2-s2.0-85136593506&doi=10.1007%2fs12080-022-00542-0&partnerID=40&md5=292a62d30f6f2b3f1a1a181d95ebb01e","All Open Access, Hybrid Gold, Green"
"Albers J., Reichert M.S.","Personality affects individual variation in olfactory learning and reversal learning in the house cricket, Acheta domesticus",2022,"Animal Behaviour","10.1016/j.anbehav.2022.06.013","https://www.scopus.com/inward/record.uri?eid=2-s2.0-85134254899&doi=10.1016%2fj.anbehav.2022.06.013&partnerID=40&md5=92bd2a72836c925f2704440564285fd5",""
"Wang J.","Global existence and stabilization in a forager–exploiter model with general logistic sources",2022,"Nonlinear Analysis, Theory, Methods and Applications","10.1016/j.na.2022.112985","https://www.scopus.com/inward/record.uri?eid=2-s2.0-85130374801&doi=10.1016%2fj.na.2022.112985&partnerID=40&md5=561055a3e5fd7381711eef7313c17ed9","All Open Access, Green"
"Griffin L.L., Haigh A., Amin B., Faull J., Norman A., Ciuti S.","Artificial selection in human-wildlife feeding interactions",2022,"Journal of Animal Ecology","10.1111/1365-2656.13771","https://www.scopus.com/inward/record.uri?eid=2-s2.0-85129556975&doi=10.1111%2f1365-2656.13771&partnerID=40&md5=18b59e24e1f71e66fb906579ba3f304e","All Open Access, Green"
"Gad A.G., Sallam K.M., Chakrabortty R.K., Ryan M.J., Abohany A.A.","An improved binary sparrow search algorithm for feature selection in data classification",2022,"Neural Computing and Applications","10.1007/s00521-022-07203-7","https://www.scopus.com/inward/record.uri?eid=2-s2.0-85128818804&doi=10.1007%2fs00521-022-07203-7&partnerID=40&md5=285249f2df1f6a8374dd874afc3343f8","All Open Access, Hybrid Gold"
"Leimar O., Dall S.R.X., Houston A.I., McNamara J.M.","Behavioural specialization and learning in social networks",2022,"Proceedings of the Royal Society B: Biological Sciences","10.1098/rspb.2022.0954","https://www.scopus.com/inward/record.uri?eid=2-s2.0-85135728664&doi=10.1098%2frspb.2022.0954&partnerID=40&md5=c02957d16e27847a38dcc98b33d54b0a","All Open Access, Hybrid Gold, Green"
"Harding C.D., Yovel Y., Peirson S.N., Hackett T.D., Vyazovskiy V.V.","Re-examining extreme sleep duration in bats: Implications for sleep phylogeny, ecology, and function",2022,"Sleep","10.1093/sleep/zsac064","https://www.scopus.com/inward/record.uri?eid=2-s2.0-85136314212&doi=10.1093%2fsleep%2fzsac064&partnerID=40&md5=4c52761f8a1811543638b9a31e5abff2","All Open Access, Hybrid Gold, Green"
"Borycz J., Horne B.D., Bentley R.A.","FORKING PATHS OF CULTURAL COMPLEXITY: A CASE STUDY OF RESEARCH PARADIGMS",2022,"Advances in Complex Systems","10.1142/S0219525922400045","https://www.scopus.com/inward/record.uri?eid=2-s2.0-85134373706&doi=10.1142%2fS0219525922400045&partnerID=40&md5=b2e642a2c7154f1bd0a4fbe495362c81","All Open Access, Hybrid Gold"
"Parthasarathy B., Müller M., Bilde T., Schneider J.M.","Hunger state and not personality determines task participation in a spider society",2022,"Animal Behaviour","10.1016/j.anbehav.2022.06.002","https://www.scopus.com/inward/record.uri?eid=2-s2.0-85133632871&doi=10.1016%2fj.anbehav.2022.06.002&partnerID=40&md5=3eabe82df6d5e622031f61605c4107f6",""
"Borofsky T., Feldman M.W.","Success-biased social learning in a one-consumer, two-resource model",2022,"Theoretical Population Biology","10.1016/j.tpb.2022.05.004","https://www.scopus.com/inward/record.uri?eid=2-s2.0-85132737236&doi=10.1016%2fj.tpb.2022.05.004&partnerID=40&md5=4c1fa2128e902901fda21ffa47c354b3","All Open Access, Hybrid Gold"
"Carvalho L.N., dos Santos Júnior J.B., Correa S.B.","Fish thieves: An alternative tactic of food capture in a Neotropical frugivorous species (Brycon falcatus)",2022,"Austral Ecology","10.1111/aec.13201","https://www.scopus.com/inward/record.uri?eid=2-s2.0-85132198643&doi=10.1111%2faec.13201&partnerID=40&md5=00af759bc52e0b72d19b6dd22607bf43",""
"Wang J., Wang D., Chen Q., Zhang J., Racey P., Jiang Y., Wan D., Yin J.","Female Java sparrows prefer high exploratory males without assortative mating",2022,"Behavioural Processes","10.1016/j.beproc.2022.104671","https://www.scopus.com/inward/record.uri?eid=2-s2.0-85131459708&doi=10.1016%2fj.beproc.2022.104671&partnerID=40&md5=40da4723792bbf2bcda378380e6c4390",""
"Sagot M., Giacomini G., Chaves-Ramírez S., Hernández-Pinsón H.A., Chaverri G.","Vocal behavior and the use of social information during roost finding",2022,"Frontiers in Ecology and Evolution","10.3389/fevo.2022.905925","https://www.scopus.com/inward/record.uri?eid=2-s2.0-85135613397&doi=10.3389%2ffevo.2022.905925&partnerID=40&md5=d9e7187f1e0d52c7c013547e38a8321b","All Open Access, Gold"
"Bidari S., El Hady A., Davidson J.D., Kilpatrick Z.P.","Stochastic dynamics of social patch foraging decisions",2022,"Physical Review Research","10.1103/PhysRevResearch.4.033128","https://www.scopus.com/inward/record.uri?eid=2-s2.0-85137264461&doi=10.1103%2fPhysRevResearch.4.033128&partnerID=40&md5=e09f3340af120f0c8ad3095ef7c3707f","All Open Access, Gold, Green"
"Ma W., Qiu L., Sun F., Ghoneim S.S.M., Duan J.","PV Power Forecasting Based on Relevance Vector Machine with Sparrow Search Algorithm Considering Seasonal Distribution and Weather Type",2022,"Energies","10.3390/en15145231","https://www.scopus.com/inward/record.uri?eid=2-s2.0-85136368225&doi=10.3390%2fen15145231&partnerID=40&md5=83c235a09b26cac1ee0d98e93041a152","All Open Access, Gold"
"Laranjeira C., Pereira F., Querido A., Bieri M., Verloo H.","Contributing Factors of Presenteeism among Portuguese and Swiss Nurses: A Qualitative Study Using Focus Groups",2022,"International Journal of Environmental Research and Public Health","10.3390/ijerph19148844","https://www.scopus.com/inward/record.uri?eid=2-s2.0-85135109521&doi=10.3390%2fijerph19148844&partnerID=40&md5=3320e20e858ae0bd74a8d1d9b71db826","All Open Access, Gold, Green"
"Beauchamp G.","Colonial breeding birds show greater annual adult apparent survival globally",2022,"Ibis","10.1111/ibi.13049","https://www.scopus.com/inward/record.uri?eid=2-s2.0-85124515773&doi=10.1111%2fibi.13049&partnerID=40&md5=bb59686c34380fe16dffd54ef90310c9",""
"Xiong Q., Shen J., Tong B., Xiong Y.","Parameter Identification for Memristive Chaotic System Using Modified Sparrow Search Algorithm",2022,"Frontiers in Physics","10.3389/fphy.2022.912606","https://www.scopus.com/inward/record.uri?eid=2-s2.0-85133917584&doi=10.3389%2ffphy.2022.912606&partnerID=40&md5=0de22b726a8c6789a5126c0b5956d111","All Open Access, Gold"
"King A.J., Marshall H.H.","Optimal foraging",2022,"Current Biology","10.1016/j.cub.2022.04.072","https://www.scopus.com/inward/record.uri?eid=2-s2.0-85132217423&doi=10.1016%2fj.cub.2022.04.072&partnerID=40&md5=79bb68c41b85c8fb08ed8c5d2d923c79",""
"Yu C.-N., Kuo C.-Y., Lin H.-C., Su Y.-C.","Foraging Payoffs Change With Group Size in Kin and Non-kin Groups of an Argyrodinae Kleptoparasitic Spider, Argyrodes miniaceus",2022,"Frontiers in Ecology and Evolution","10.3389/fevo.2022.813777","https://www.scopus.com/inward/record.uri?eid=2-s2.0-85133307330&doi=10.3389%2ffevo.2022.813777&partnerID=40&md5=f4ec0af812123103ae01915fb85177a6","All Open Access, Gold"
"Bibi N., Yu J., Gong Y., Mo T.S., Zubair M., Wang H.","Influence of social context on Cinereous Tit (Parus cinereus) neophobic behavior",2022,"Wilson Journal of Ornithology","10.1676/21-00007","https://www.scopus.com/inward/record.uri?eid=2-s2.0-85133453222&doi=10.1676%2f21-00007&partnerID=40&md5=84c2e63d2336bc520d96eddeffeafbe1",""
"Poindexter S.A.","Strepsirrhine movement and navigation: sense and sociality",2022,"Current Opinion in Behavioral Sciences","10.1016/j.cobeha.2022.101133","https://www.scopus.com/inward/record.uri?eid=2-s2.0-85129950531&doi=10.1016%2fj.cobeha.2022.101133&partnerID=40&md5=ab4329dbb9b366a1ffdab06177b14e35",""
"Pravosudov V.V.","Cognitive ecology in the wild — advances and challenges in avian cognition research",2022,"Current Opinion in Behavioral Sciences","10.1016/j.cobeha.2022.101138","https://www.scopus.com/inward/record.uri?eid=2-s2.0-85129946260&doi=10.1016%2fj.cobeha.2022.101138&partnerID=40&md5=461ecf65f191bbc96142553ee550a1e7",""
"Schauer D.","Reputation for Competence: Social Learning Mechanisms Create an Incentive to Help Others",2022,"Biological Theory","10.1007/s13752-022-00396-z","https://www.scopus.com/inward/record.uri?eid=2-s2.0-85124506999&doi=10.1007%2fs13752-022-00396-z&partnerID=40&md5=8abd9293ec9d161544abf994c2d00acc","All Open Access, Hybrid Gold"
"Okouchi H.","Effects of Transmitted Verbal Descriptions on Human Responding under a Schedule of Reinforcement",2022,"Psychological Record","10.1007/s40732-022-00507-z","https://www.scopus.com/inward/record.uri?eid=2-s2.0-85124147095&doi=10.1007%2fs40732-022-00507-z&partnerID=40&md5=63cb4247fa820b142a83cf2791b9309e",""
"van Overveld T., Sol D., Blanco G., Margalida A., de la Riva M., Donázar J.A.","Vultures as an overlooked model in cognitive ecology",2022,"Animal Cognition","10.1007/s10071-021-01585-2","https://www.scopus.com/inward/record.uri?eid=2-s2.0-85120646654&doi=10.1007%2fs10071-021-01585-2&partnerID=40&md5=95c214a661ca971062b01a6d42e69f99",""
"Lattin C.R., Kelly T.R., Kelly M.W., Johnson K.M.","Constitutive gene expression differs in three brain regions important for cognition in neophobic and non-neophobic house sparrows (Passer domesticus)",2022,"PLoS ONE","10.1371/journal.pone.0267180","https://www.scopus.com/inward/record.uri?eid=2-s2.0-85130000155&doi=10.1371%2fjournal.pone.0267180&partnerID=40&md5=b9df1dc4cc6ef45fae3ecb061c9b3125","All Open Access, Gold, Green"
"Sharma B., Hashmi A., Gupta C., Khalaf O.I., Abdulsahib G.M., Itani M.M.","Hybrid Sparrow Clustered (HSC) Algorithm for Top-N Recommendation System",2022,"Symmetry","10.3390/sym14040793","https://www.scopus.com/inward/record.uri?eid=2-s2.0-85129098608&doi=10.3390%2fsym14040793&partnerID=40&md5=518a143c48511577098fa90a4679328f","All Open Access, Gold"
"Lu C., Lefeuvre M., Rutkowska J.","Variability in ambient temperature promotes juvenile participation and shorter latency in a learning test in zebra finches",2022,"Animal Behaviour","10.1016/j.anbehav.2022.01.010","https://www.scopus.com/inward/record.uri?eid=2-s2.0-85125435387&doi=10.1016%2fj.anbehav.2022.01.010&partnerID=40&md5=2cb9c71c1edd135c33840af76727d2cc","All Open Access, Hybrid Gold, Green"
"Bellomo N., Outada N., Soler J., Tao Y., Winkler M.","Chemotaxis and cross-diffusion models in complex environments: Models and analytic problems toward a multiscale vision",2022,"Mathematical Models and Methods in Applied Sciences","10.1142/S0218202522500166","https://www.scopus.com/inward/record.uri?eid=2-s2.0-85121607493&doi=10.1142%2fS0218202522500166&partnerID=40&md5=93b26e03987c18c0c3ecc05255352fe8","All Open Access, Hybrid Gold, Green"
"Gartland L.A., Firth J.A., Laskowski K.L., Jeanson R., Ioannou C.C.","Sociability as a personality trait in animals: methods, causes and consequences",2022,"Biological Reviews","10.1111/brv.12823","https://www.scopus.com/inward/record.uri?eid=2-s2.0-85120890412&doi=10.1111%2fbrv.12823&partnerID=40&md5=3ddc2a9a9eac380e0390d2dff6589219","All Open Access, Hybrid Gold, Green"
"Faure P., Fayad S.L., Solié C., Reynolds L.M.","Social Determinants of Inter-Individual Variability and Vulnerability: The Role of Dopamine",2022,"Frontiers in Behavioral Neuroscience","10.3389/fnbeh.2022.836343","https://www.scopus.com/inward/record.uri?eid=2-s2.0-85127960655&doi=10.3389%2ffnbeh.2022.836343&partnerID=40&md5=7eb59d9c309680a0802961fbcfe7646c","All Open Access, Gold, Green"
