Authors,Title,Year,Source title,DOI,Link,Open Access
"Stenberg M., Persson A.","The effects of spatial food distribution and group size on foraging behaviour in a benthic fish",2005,"Behavioural Processes","10.1016/j.beproc.2005.04.003","https://www.scopus.com/inward/record.uri?eid=2-s2.0-20444493487&doi=10.1016%2fj.beproc.2005.04.003&partnerID=40&md5=a98cb74bc4166655ed47a4a61db5373b",""
"Åhlund M.","Behavioural tactics at nest visits differ between parasites and hosts in a brood-parasitic duck",2005,"Animal Behaviour","10.1016/j.anbehav.2004.12.006","https://www.scopus.com/inward/record.uri?eid=2-s2.0-22144433700&doi=10.1016%2fj.anbehav.2004.12.006&partnerID=40&md5=cd72da83a25f4c8aa0fa1334ee7641ea",""
"Cameron E.Z., Du Toit J.T.","Social influences on vigilance behaviour in giraffes, Giraffa camelopardalis",2005,"Animal Behaviour","10.1016/j.anbehav.2004.08.015","https://www.scopus.com/inward/record.uri?eid=2-s2.0-20444403437&doi=10.1016%2fj.anbehav.2004.08.015&partnerID=40&md5=453c7885ca2299f88b4590a104cc2bc4",""
"Bretman A., Tregenza T.","Measuring polyandry in wild populations: A case study using promiscuous crickets",2005,"Molecular Ecology","10.1111/j.1365-294X.2005.02556.x","https://www.scopus.com/inward/record.uri?eid=2-s2.0-20144372758&doi=10.1111%2fj.1365-294X.2005.02556.x&partnerID=40&md5=67e2324290c9028baf2d83a28a99ee0c",""
"Beauchamp G., Fernández-Juricic E.","The group-size paradox: Effects of learning and patch departure rules",2005,"Behavioral Ecology","10.1093/beheco/arh169","https://www.scopus.com/inward/record.uri?eid=2-s2.0-14644400526&doi=10.1093%2fbeheco%2farh169&partnerID=40&md5=783fe485503f1e004b5f69e7f64ecd7f","All Open Access, Bronze, Green"
"Tallamy D.W.","Egg dumping in insects",2005,"Annual Review of Entomology","10.1146/annurev.ento.50.071803.130424","https://www.scopus.com/inward/record.uri?eid=2-s2.0-12744259777&doi=10.1146%2fannurev.ento.50.071803.130424&partnerID=40&md5=c50bf1cca2a6fc50d085954120b7ec8e",""
"Hénaut Y., Delme J., Legal L., Williams T.","Host selection by a kleptobiotic spider",2005,"Naturwissenschaften","10.1007/s00114-004-0597-6","https://www.scopus.com/inward/record.uri?eid=2-s2.0-13844265734&doi=10.1007%2fs00114-004-0597-6&partnerID=40&md5=d7439878a288a9bd09a33eb74fde79f1",""
"Ward A.J.W., Hart P.J.B.","Foraging benefits of shoaling with familiars may be exploited by outsiders",2005,"Animal Behaviour","10.1016/j.anbehav.2004.06.005","https://www.scopus.com/inward/record.uri?eid=2-s2.0-11844296783&doi=10.1016%2fj.anbehav.2004.06.005&partnerID=40&md5=16cf444bb0639aeb6b0c032bcd96f0c6",""
"Gazda S.K., Connor R.C., Edgar R.K., Cox F.","A division of labour with role specialization in group-hunting bottlenose dolphins (Tursiops truncatus) off Cedar Key, Florida",2005,"Proceedings of the Royal Society B: Biological Sciences","10.1098/rspb.2004.2937","https://www.scopus.com/inward/record.uri?eid=2-s2.0-16844367807&doi=10.1098%2frspb.2004.2937&partnerID=40&md5=4b6fe089e19728bc541b467ec97795d0","All Open Access, Green"
"Houser J.D., Jennings D.T., Jakob E.M.","Predation by Argyrodes trigonum on Linyphia triangularis, an invasive sheet-web weaver in coastal Maine",2005,"Journal of Arachnology","10.1636/S03-15","https://www.scopus.com/inward/record.uri?eid=2-s2.0-21344438376&doi=10.1636%2fS03-15&partnerID=40&md5=6f67eb1edba0e74dc5ed98ce95ec2576","All Open Access, Green"
"Galef Jr. B.G., Laland K.N.","Social learning in animals: Empirical studies and theoretical models",2005,"BioScience","10.1641/0006-3568(2005)055[0489:SLIAES]2.0.CO;2","https://www.scopus.com/inward/record.uri?eid=2-s2.0-19944372042&doi=10.1641%2f0006-3568%282005%29055%5b0489%3aSLIAES%5d2.0.CO%3b2&partnerID=40&md5=c08ece0ff19b0496db577455f1509c6c","All Open Access, Bronze"
"Forman D.W.","Laying plasticity in an avian brood parasite",2005,"Auk","10.1642/0004-8038(2005)122[0566:LPIAAB]2.0.CO;2","https://www.scopus.com/inward/record.uri?eid=2-s2.0-18744391135&doi=10.1642%2f0004-8038%282005%29122%5b0566%3aLPIAAB%5d2.0.CO%3b2&partnerID=40&md5=293b7cd2fd76da8ca42e68a40ed2574c",""
"Faircloth B.C., Palmer W.E., Carroll J.P.","Post-hatching brood amalgamation in Northern Bobwhites",2005,"Journal of Field Ornithology","10.1648/0273-8570-76.2.175","https://www.scopus.com/inward/record.uri?eid=2-s2.0-18044390143&doi=10.1648%2f0273-8570-76.2.175&partnerID=40&md5=98d7ae426adfc27ec12361c886f36b0c",""
"Williams P.D., Day T., Cameron E.","The evolution of sperm-allocation strategies and the degree of sperm competition",2005,"Evolution","10.1111/j.0014-3820.2005.tb01009.x","https://www.scopus.com/inward/record.uri?eid=2-s2.0-15944375906&doi=10.1111%2fj.0014-3820.2005.tb01009.x&partnerID=40&md5=f448ee616d370988e29ae97bd498614b","All Open Access, Bronze"
"Dall S.R.X., Giraldeau L.-A., Olsson O., McNamara J.M., Stephens D.W.","Information and its use by animals in evolutionary ecology",2005,"Trends in Ecology and Evolution","10.1016/j.tree.2005.01.010","https://www.scopus.com/inward/record.uri?eid=2-s2.0-14944363098&doi=10.1016%2fj.tree.2005.01.010&partnerID=40&md5=0305f436ddc6b9c1196ad54183bfa5ee",""
"Gerhardt F.","Food pilfering in larder-hoarding red squirrels (Tamiasciurus hudsonicus)",2005,"Journal of Mammalogy","10.1644/1545-1542(2005)086<0108:FPILRS>2.0.CO;2","https://www.scopus.com/inward/record.uri?eid=2-s2.0-14044263567&doi=10.1644%2f1545-1542%282005%29086%3c0108%3aFPILRS%3e2.0.CO%3b2&partnerID=40&md5=45f952a9e30888f04ca85236adfa2a38","All Open Access, Bronze"
"Dubois F., Giraldeau L.-A.","Fighting for resources: The economics of defense and appropriation",2005,"Ecology","10.1890/04-0566","https://www.scopus.com/inward/record.uri?eid=2-s2.0-13444274539&doi=10.1890%2f04-0566&partnerID=40&md5=f380e5481bca21b8671956447e6a5a20",""
"Wu G.-M., Giraldeau L.-A.","Risky decisions: A test of risk sensitivity in socially foraging flocks of Lonchura punctulata",2005,"Behavioral Ecology","10.1093/beheco/arh127","https://www.scopus.com/inward/record.uri?eid=2-s2.0-12244301210&doi=10.1093%2fbeheco%2farh127&partnerID=40&md5=8b75cb2c4232f482fea94691dcdd1e31","All Open Access, Bronze"
"Groothuis T.G.G., Carere C.","Avian personalities: Characterization and epigenesis",2005,"Neuroscience and Biobehavioral Reviews","10.1016/j.neubiorev.2004.06.010","https://www.scopus.com/inward/record.uri?eid=2-s2.0-11844299005&doi=10.1016%2fj.neubiorev.2004.06.010&partnerID=40&md5=408c045da57d12488677b130c2d4133a",""
"Summers K.","The evolutionary ecology of despotism",2005,"Evolution and Human Behavior","10.1016/j.evolhumbehav.2004.09.001","https://www.scopus.com/inward/record.uri?eid=2-s2.0-11244260720&doi=10.1016%2fj.evolhumbehav.2004.09.001&partnerID=40&md5=99a6310a903cdd0a0411bdc09a7e757f",""
"Fernández-Juricic E., Smith R., Kacelnik A.","Increasing the costs of conspecific scanning in socially foraging starlings affects vigilance and foraging behaviour",2005,"Animal Behaviour","10.1016/j.anbehav.2004.01.019","https://www.scopus.com/inward/record.uri?eid=2-s2.0-11144340477&doi=10.1016%2fj.anbehav.2004.01.019&partnerID=40&md5=dd15137060fdc78e2c7ad8ffbea243d6",""
"Lendvai Á.Z., Barta Z., Liker A., Bókony V.","The effect of energy reserves on social foraging: Hungry sparrows scrounge more",2004,"Proceedings of the Royal Society B: Biological Sciences","10.1098/rspb.2004.2887","https://www.scopus.com/inward/record.uri?eid=2-s2.0-16644377762&doi=10.1098%2frspb.2004.2887&partnerID=40&md5=9f134450b347775fcaed10b8ea0b0588","All Open Access, Green"
"Layton R.","Are immediate-return strategies adaptive?",2004,"Property and Equality: Volume I: Ritualization, Sharing, Egalitarianism",,"https://www.scopus.com/inward/record.uri?eid=2-s2.0-85124116560&partnerID=40&md5=4a460a7199cbed3984cc9f76ee0b28a1",""
"Brown C.R., Brown M.B.","Mark-recapture and behavioral ecology: A case study of Cliff Swallows",2004,"Animal Biodiversity and Conservation",,"https://www.scopus.com/inward/record.uri?eid=2-s2.0-16844364770&partnerID=40&md5=18498f83f172d785547e180ca15c25ad",""
"González-Megías A., Sánchez-Piñero F.","Response of host species to brood parasitism in dung beetles: Importance of nest location by parasitic species",2004,"Functional Ecology","10.1111/j.0269-8463.2004.00938.x","https://www.scopus.com/inward/record.uri?eid=2-s2.0-11144343817&doi=10.1111%2fj.0269-8463.2004.00938.x&partnerID=40&md5=9d2cc9545aa9fc7b720248e305a14e1e",""
"Gros-Louis J.","Responses of white-faced capuchins (Cebus capucinus) to naturalistic and experimentally presented food-associated calls",2004,"Journal of Comparative Psychology","10.1037/0735-7036.118.4.396","https://www.scopus.com/inward/record.uri?eid=2-s2.0-11144236195&doi=10.1037%2f0735-7036.118.4.396&partnerID=40&md5=21ded7d1c4ad88849c08505ad372030d",""
"Broom M., Luther R.M., Ruxton G.D.","Resistance is useless? - Extensions to the game theory of kleptoparasitism",2004,"Bulletin of Mathematical Biology","10.1016/j.bulm.2004.03.009","https://www.scopus.com/inward/record.uri?eid=2-s2.0-7444256643&doi=10.1016%2fj.bulm.2004.03.009&partnerID=40&md5=ed350f937346670c446d6caa8c6e5cfb",""
"Whittingham M.J., Evans K.L.","The effects of habitat structure on predation risk of birds in agricultural landscapes",2004,"Ibis","10.1111/j.1474-919X.2004.00370.x","https://www.scopus.com/inward/record.uri?eid=2-s2.0-11244280133&doi=10.1111%2fj.1474-919X.2004.00370.x&partnerID=40&md5=775c31f6568a56bc709d830c61c70b8e",""
"Beauchamp G.","On the use of public information by social foragers to assess patch quality",2004,"Oikos","10.1111/j.0030-1299.2004.13077.x","https://www.scopus.com/inward/record.uri?eid=2-s2.0-5344278339&doi=10.1111%2fj.0030-1299.2004.13077.x&partnerID=40&md5=289a668165f75a71cd3e79d18c287756",""
"Beauchamp G., Fernández-Juricic E.","Is there a relationship between forebrain size and group size in birds?",2004,"Evolutionary Ecology Research",,"https://www.scopus.com/inward/record.uri?eid=2-s2.0-4644296396&partnerID=40&md5=bcb9c1f2b8148c5fcb856136f457237b",""
"Sih A., Bell A.M., Johnson J.C., Ziemba R.E.","Behavioral syndromes: An integrative overview",2004,"Quarterly Review of Biology","10.1086/422893","https://www.scopus.com/inward/record.uri?eid=2-s2.0-2942757889&doi=10.1086%2f422893&partnerID=40&md5=5a84b14f4d204361c791df7b5cc6227a",""
"Morrell L.J., Kokko H.","Can too strong female choice deteriorate male ornamentation?",2004,"Proceedings of the Royal Society B: Biological Sciences","10.1098/rspb.2004.2763","https://www.scopus.com/inward/record.uri?eid=2-s2.0-3242882448&doi=10.1098%2frspb.2004.2763&partnerID=40&md5=9ebb7547c3dcebf9f9890054cbe52ff3","All Open Access, Green"
"You Z., Jiang Z.","Leks mating system and its mechanism",2004,"Acta Theriologica Sinica",,"https://www.scopus.com/inward/record.uri?eid=2-s2.0-4344711497&partnerID=40&md5=1f36e59b2b6f06c08c9dc895d25308ca",""
"Agnarsson I.","Morphological phylogeny of cobweb spiders and their relatives (Araneae, Araneoidea, Theridiidae)",2004,"Zoological Journal of the Linnean Society","10.1111/j.1096-3642.2004.00120.x","https://www.scopus.com/inward/record.uri?eid=2-s2.0-4243049156&doi=10.1111%2fj.1096-3642.2004.00120.x&partnerID=40&md5=e7cd45963a394e17926cb4778fe421b8","All Open Access, Green"
"Whittingham M.J., Butler S.J., Quinn J.L., Cresswell W.","The effect of limited visibility on vigilance behaviour and speed of predator detection: Implications for the conservation of granivorous passerines",2004,"Oikos","10.1111/j.0030-1299.2004.13132.x","https://www.scopus.com/inward/record.uri?eid=2-s2.0-4043133883&doi=10.1111%2fj.0030-1299.2004.13132.x&partnerID=40&md5=4f3488958499089c1794795ef7180d8f",""
"Figenschou L., Folstad I., Liljedal S.","Lek fidelity of male Arctic charr",2004,"Canadian Journal of Zoology","10.1139/Z04-106","https://www.scopus.com/inward/record.uri?eid=2-s2.0-12744281092&doi=10.1139%2fZ04-106&partnerID=40&md5=93a87d2f2aa4755646934649acab666c",""
"Dubois F., Giraldeau L.-A.","Reduced resource defence in an uncertain world: An experimental test using captive nutmeg mannikins",2004,"Animal Behaviour","10.1016/j.anbehav.2003.06.025","https://www.scopus.com/inward/record.uri?eid=2-s2.0-3042781791&doi=10.1016%2fj.anbehav.2003.06.025&partnerID=40&md5=e8adfd292f1a518a152ecac4251a08a1",""
"Jakob E.M.","Individual decisions and group dynamics: Why pholcid spiders join and leave groups",2004,"Animal Behaviour","10.1016/j.anbehav.2003.06.026","https://www.scopus.com/inward/record.uri?eid=2-s2.0-3042744122&doi=10.1016%2fj.anbehav.2003.06.026&partnerID=40&md5=2c970f49f1c77164ea8f1c8093189604",""
"Waldeck P., Kilpi M., Öst M., Andersson M.","Brood parasitism in a population of common eider (Somateria mollissima)",2004,"Behaviour","10.1163/1568539042245132","https://www.scopus.com/inward/record.uri?eid=2-s2.0-4243183590&doi=10.1163%2f1568539042245132&partnerID=40&md5=7187847babbb3b692fa349acd2a50b61",""
"Kitchen D.M., Horwich R.H., James R.A.","Subordinate male black howler monkey (Alouatta pigra) responses to loud calls: Experimental evidence for the effects of intra-group male relationships and age",2004,"Behaviour","10.1163/1568539042245196","https://www.scopus.com/inward/record.uri?eid=2-s2.0-4243158502&doi=10.1163%2f1568539042245196&partnerID=40&md5=b2b31faaedd18a574c99a3f0b04c6951",""
"Poirier N.E., Whittingham L.A., Dunn P.O.","Males achieve greater reproductive success through multiple broods than through extrapair mating in house wrens",2004,"Animal Behaviour","10.1016/j.anbehav.2003.06.020","https://www.scopus.com/inward/record.uri?eid=2-s2.0-3042701780&doi=10.1016%2fj.anbehav.2003.06.020&partnerID=40&md5=f0ce22a37fe4ab49ef550321b87dda76",""
"Broom M., Ruxton G.D.","A framework for modelling and analysing conspecific brood parasitism",2004,"Journal of Mathematical Biology","10.1007/s00285-003-0244-4","https://www.scopus.com/inward/record.uri?eid=2-s2.0-21244487113&doi=10.1007%2fs00285-003-0244-4&partnerID=40&md5=ac2ecc7d4f7b10a9bf090314691bbf9e","All Open Access, Green"
"Fernández-Juricic E., Siller S., Kacelnik A.","Flock density, social foraging, and scanning: An experiment with starlings",2004,"Behavioral Ecology","10.1093/beheco/arh017","https://www.scopus.com/inward/record.uri?eid=2-s2.0-1642410692&doi=10.1093%2fbeheco%2farh017&partnerID=40&md5=68092f95b7f95222f7707a7f141bb64f","All Open Access, Bronze"
"Plowright C.M.S., Church D., Sogbein O., Potvin A., Gagnon L.","Two solitudes: The behaviour of pigeons in competitive feeding",2004,"Behaviour","10.1163/156853904323066711","https://www.scopus.com/inward/record.uri?eid=2-s2.0-3042691359&doi=10.1163%2f156853904323066711&partnerID=40&md5=f92eae7d3f27d0a44662b4d8c5ad9094",""
"Ward A.J.W., Thomas P., Hart P.J.B., Krause J.","Correlates of boldness in three-spined sticklebacks (Gasterosteus aculeatus)",2004,"Behavioral Ecology and Sociobiology","10.1007/s00265-003-0751-8","https://www.scopus.com/inward/record.uri?eid=2-s2.0-1942477368&doi=10.1007%2fs00265-003-0751-8&partnerID=40&md5=7135f03f34825c56ac770d61e0056c7f",""
"Luttbeg B.","Female mate assessment and choice behavior affect the frequency of alternative male mating tactics",2004,"Behavioral Ecology","10.1093/beheco/arh002","https://www.scopus.com/inward/record.uri?eid=2-s2.0-1942475997&doi=10.1093%2fbeheco%2farh002&partnerID=40&md5=871213b0bd50d0d0c39c2dbca9ac2f6e","All Open Access, Bronze"
"Gauvin S., Giraldeau L.-A.","Nutmeg mannikins (Lonchura punctulata) reduce their feeding rates in response to simulated competition",2004,"Oecologia","10.1007/s00442-003-1482-2","https://www.scopus.com/inward/record.uri?eid=2-s2.0-1942443945&doi=10.1007%2fs00442-003-1482-2&partnerID=40&md5=80b971a453143ae4c4f82ac68b587a43",""
"Iyengar E.V.","Host-specific performance and host use in the kleptoparasitic marine snail Trichotropis cancellata",2004,"Oecologia","10.1007/s00442-003-1467-1","https://www.scopus.com/inward/record.uri?eid=2-s2.0-1642308811&doi=10.1007%2fs00442-003-1467-1&partnerID=40&md5=46fe2f8fadf248d1c605f656eaf296b9",""
"Miyashita T., Maezono Y., Shimazaki A.","Silk feeding as an alternative foraging tactic in a kleptoparasitic spider under seasonally changing environments",2004,"Journal of Zoology","10.1017/S0952836903004540","https://www.scopus.com/inward/record.uri?eid=2-s2.0-1542348941&doi=10.1017%2fS0952836903004540&partnerID=40&md5=0adaa066603bfde369a183ee359ad94b","All Open Access, Green"
"Fernández-Juricic E., Kacelnik A.","Information transfer and gain in flocks: The effects of quality and quantity of social information at different neighbour distances",2004,"Behavioral Ecology and Sociobiology","10.1007/s00265-003-0698-9","https://www.scopus.com/inward/record.uri?eid=2-s2.0-12144287829&doi=10.1007%2fs00265-003-0698-9&partnerID=40&md5=5fde7e3e530e8153c857f4713377195d",""
"Tsukasaki T., Kameda T.","Utility of the agent-based model in social psychological research: On the adaptive perspective and evolutionary computer simulations",2004,"Sociological Theory and Methods",,"https://www.scopus.com/inward/record.uri?eid=2-s2.0-10444231146&partnerID=40&md5=3644cbccc2e5ee32fe1ad439e4906282",""
"Booth-Binczik S.D., Binczik G.A., Labisky R.F.","Lek-like mating in white-nosed coatis (Nasua narica): Socio-ecological correlates of intraspecific variability in mating systems",2004,"Journal of Zoology","10.1017/S0952836903004527","https://www.scopus.com/inward/record.uri?eid=2-s2.0-1242310613&doi=10.1017%2fS0952836903004527&partnerID=40&md5=648aeab97f4ae6653f33f8c9aa4f85b6",""
"Weaver H.B., Brown C.R.","Brood parasitism and egg transfer in cave swallows (Petrochelidon fulva) and Cliff Swallows (P. pyrrhonota) in South Texas",2004,"Auk","10.1093/auk/121.4.1122","https://www.scopus.com/inward/record.uri?eid=2-s2.0-7644224046&doi=10.1093%2fauk%2f121.4.1122&partnerID=40&md5=5c6c84381677e29685412a4c0cce829d","All Open Access, Bronze"
"Gurven M.","Reciprocal altruism and food sharing decisions among Hiwi and Ache hunter-gatherers",2004,"Behavioral Ecology and Sociobiology","10.1007/s00265-004-0793-6","https://www.scopus.com/inward/record.uri?eid=2-s2.0-4143096141&doi=10.1007%2fs00265-004-0793-6&partnerID=40&md5=6884bae66b1357a00d0efd3eca200b98",""
"Marlowe F.W.","WHAT EXPLAINS HADZA FOOD SHARING?",2004,"Research in Economic Anthropology","10.1016/S0190-1281(04)23003-7","https://www.scopus.com/inward/record.uri?eid=2-s2.0-33644872181&doi=10.1016%2fS0190-1281%2804%2923003-7&partnerID=40&md5=b8ad302f8f5fcd104aebe94e709fad48","All Open Access, Green"
"Marques J.T., Rainho A., Carapuço M., Oliveira P., Palmeirim J.M.","Foraging behaviour and habitat use by the European free-tailed bat Tadarida teniotis",2004,"Acta Chiropterologica","10.3161/001.006.0108","https://www.scopus.com/inward/record.uri?eid=2-s2.0-3242887685&doi=10.3161%2f001.006.0108&partnerID=40&md5=f7d7c549eee9b5f516be511bef7743c4","All Open Access, Bronze, Green"
"Griffith S.C., Lyon B.E., Montgomerie R.","Quasi-parasitism in birds",2004,"Behavioral Ecology and Sociobiology","10.1007/s00265-004-0766-9","https://www.scopus.com/inward/record.uri?eid=2-s2.0-3242740328&doi=10.1007%2fs00265-004-0766-9&partnerID=40&md5=c04c70466ced66ade9e2a1b5bf224389",""
"Dubois F., Wajnberg É., Cézilly F.","Optimal divorce and re-mating strategies for monogamous female birds: A simulation model",2004,"Behavioral Ecology and Sociobiology","10.1007/s00265-004-0780-y","https://www.scopus.com/inward/record.uri?eid=2-s2.0-3242719683&doi=10.1007%2fs00265-004-0780-y&partnerID=40&md5=b526aea6251dec46f5d86220a8eec9db",""
"Byers B.E., Mays Jr. H.L., Stewart I.R.K., Westneat D.F.","Extrapair paternity increases variability in male reproductive success in the chestnut-sided warbler (Dendroica pensylvanica), a socially monogamous songbird",2004,"Auk","10.2307/4090315","https://www.scopus.com/inward/record.uri?eid=2-s2.0-3242658358&doi=10.2307%2f4090315&partnerID=40&md5=ed8e0b63dec57485c0e5e441df9ff87d","All Open Access, Green"
"Avilés J.M., Soler J.J., Soler M., Møller A.P.","Rejection of parasitic eggs in relation to egg appearance in magpies",2004,"Animal Behaviour","10.1016/j.anbehav.2003.08.022","https://www.scopus.com/inward/record.uri?eid=2-s2.0-2442534844&doi=10.1016%2fj.anbehav.2003.08.022&partnerID=40&md5=1bf17ff9c948c9e2108d943eddbb2b49",""
"Nicol C.J.","Development, direction, and damage limitation: Social learning in domestic fowl",2004,"Learning and Behavior","10.3758/bf03196008","https://www.scopus.com/inward/record.uri?eid=2-s2.0-2342622678&doi=10.3758%2fbf03196008&partnerID=40&md5=dc83a0e2ec234b309fc511946df4e259","All Open Access, Bronze"
"Laland K.N.","Social learning strategies",2004,"Learning and Behavior","10.3758/bf03196002","https://www.scopus.com/inward/record.uri?eid=2-s2.0-2342458309&doi=10.3758%2fbf03196002&partnerID=40&md5=37a8b43ebe25314fc5c41819e3e59851","All Open Access, Bronze"
"Brown G.R., Almond R.E.A., Bergen Y.v.","Begging, Stealing, and Offering: Food Transfer in Nonhuman Primates",2004,"Advances in the Study of Behavior","10.1016/S0065-3454(04)34007-6","https://www.scopus.com/inward/record.uri?eid=2-s2.0-21144440958&doi=10.1016%2fS0065-3454%2804%2934007-6&partnerID=40&md5=e3cd8f9fc41b6a9ebb95afa9d0e6d5a8","All Open Access, Green"
"Arnedo M.A., Coddington J., Agnarsson I., Gillespie R.G.","From a comb to a tree: Phylogenetic relationships of the comb-footed spiders (Araneae, Theridiidae) inferred from nuclear and mitochondrial genes",2004,"Molecular Phylogenetics and Evolution","10.1016/S1055-7903(03)00261-6","https://www.scopus.com/inward/record.uri?eid=2-s2.0-1642465357&doi=10.1016%2fS1055-7903%2803%2900261-6&partnerID=40&md5=20ce836cbc552e6014ac66ce0f2bdc4a",""
"Rowcliffe J.M., Pettifor R.A., Carbone C.","Foraging inequalities in large groups: Quantifying depletion experienced by individuals in goose flocks",2004,"Journal of Animal Ecology","10.1111/j.1365-2656.2004.00783.x","https://www.scopus.com/inward/record.uri?eid=2-s2.0-1642441442&doi=10.1111%2fj.1365-2656.2004.00783.x&partnerID=40&md5=81d1d9487bc7f0c5d5886973727c5059","All Open Access, Bronze"
"Howarth B., Edmunds M., Gilbert F.","Does the abundance of hoverfly (Syrphidae) mimics depend on the numbers of their hymenopteran models?",2004,"Evolution","10.1111/j.0014-3820.2004.tb01652.x","https://www.scopus.com/inward/record.uri?eid=2-s2.0-1642367462&doi=10.1111%2fj.0014-3820.2004.tb01652.x&partnerID=40&md5=3e9a310a3d4344cc587c2eb4c5f99ce2","All Open Access, Bronze, Green"
"Gurven M.","Tolerated reciprocity, reciprocal scrounging, and unrelated kin: Making sense of multiple models",2004,"Behavioral and Brain Sciences","10.1017/s0140525x04350120","https://www.scopus.com/inward/record.uri?eid=2-s2.0-14744279260&doi=10.1017%2fs0140525x04350120&partnerID=40&md5=5058ee7e834da3db96dec2e578aaefb9",""
"Stevens J.R., Gilby I.C.","A conceptual framework for nonkin food sharing: Timing and currency of benefits",2004,"Animal Behaviour","10.1016/j.anbehav.2003.04.012","https://www.scopus.com/inward/record.uri?eid=2-s2.0-1442316224&doi=10.1016%2fj.anbehav.2003.04.012&partnerID=40&md5=2e7afe67c0c4440a8f2930031987a744","All Open Access, Green"
"Barta Z., Liker A., Mónus F.","The effects of predation risk on the use of social foraging tactics",2004,"Animal Behaviour","10.1016/j.anbehav.2003.06.012","https://www.scopus.com/inward/record.uri?eid=2-s2.0-1442289692&doi=10.1016%2fj.anbehav.2003.06.012&partnerID=40&md5=cfa77a6f99aa7e181e7202ebc6c88e09",""
"Pöysä H.","Relatedness and the evolution of conspecific brood parasitism: Parameterizing a model with data for a precocial species",2004,"Animal Behaviour","10.1016/j.anbehav.2003.08.009","https://www.scopus.com/inward/record.uri?eid=2-s2.0-12144290839&doi=10.1016%2fj.anbehav.2003.08.009&partnerID=40&md5=e6fbbba51e709318c9a6ea168c67b533",""
"Miller III D.G.","The ecology of inquilinism in communally parasitic Tamalia aphids (Hemiptera: Aphididae)",2004,"Annals of the Entomological Society of America","10.1603/0013-8746(2004)097[1233:TEOIIC]2.0.CO;2","https://www.scopus.com/inward/record.uri?eid=2-s2.0-12144268207&doi=10.1603%2f0013-8746%282004%29097%5b1233%3aTEOIIC%5d2.0.CO%3b2&partnerID=40&md5=009c908f0012c954d99780a1d71ce2ad",""
"Richards S.A.","Optimal foraging among competitors and predators: A state-dependent model incorporating game theory",2004,"Israel Journal of Zoology","10.1560/kkc4-4cfd-5g57-edrg","https://www.scopus.com/inward/record.uri?eid=2-s2.0-10944238402&doi=10.1560%2fkkc4-4cfd-5g57-edrg&partnerID=40&md5=ca67832e1ce37a9fb6c76fcbe3ac0aa8",""
"Fernández-Juricic E., Erichsen J.T., Kacelnik A.","Visual perception and social foraging in birds",2004,"Trends in Ecology and Evolution","10.1016/j.tree.2003.10.003","https://www.scopus.com/inward/record.uri?eid=2-s2.0-0346432509&doi=10.1016%2fj.tree.2003.10.003&partnerID=40&md5=1f1fd36b2d85b84701e4e03bdb30debf","All Open Access, Green"
"Dubois F., Giraldeau L.-A.","The Forager's Dilemma: Food Sharing and Food Defense as Risk-Sensitive Foraging Options",2003,"American Naturalist","10.1086/379202","https://www.scopus.com/inward/record.uri?eid=2-s2.0-0742270741&doi=10.1086%2f379202&partnerID=40&md5=01700e024e33b59714d6b983aefc3de1",""
"Boinski S., Kauffman L., Westoll A., Stickler C.M., Cropp S., Ehmke E.","Are vigilance, risk from avian predators and group size consequences of habitat structure? A comparison of three species of squirrel monkey (Saimiri oerstedii, S. boliviensis, and S. sciureus)",2003,"Behaviour","10.1163/156853903771980666","https://www.scopus.com/inward/record.uri?eid=2-s2.0-0942302243&doi=10.1163%2f156853903771980666&partnerID=40&md5=c9d639c2a7188b4074ef2159646828a1",""
"Pöysä H.","Low host recognition tendency revealed by experimentally induced parasitic egg laying in the common goldeneye (Bucephala clangula)",2003,"Canadian Journal of Zoology","10.1139/z03-147","https://www.scopus.com/inward/record.uri?eid=2-s2.0-0346734385&doi=10.1139%2fz03-147&partnerID=40&md5=af744ed139ded817fce85e10df955f81",""
