Authors,Title,Year,Source title,DOI,Link,Open Access
"Tania N., Vanderlei B., Heath J.P., Edelstein-Keshet L.","Role of social interactions in dynamic patterns of resource patches and forager aggregation",2012,"Proceedings of the National Academy of Sciences of the United States of America","10.1073/pnas.1201739109","https://www.scopus.com/inward/record.uri?eid=2-s2.0-84863926980&doi=10.1073%2fpnas.1201739109&partnerID=40&md5=85650b6b3fef27a560b1c8d07987a7b0","All Open Access, Green"
"Atkisson C., O'Brien M.J., Mesoudi A.","Adult learners in a novel environment use prestige-biased social learning",2012,"Evolutionary Psychology","10.1177/147470491201000309","https://www.scopus.com/inward/record.uri?eid=2-s2.0-84872399037&doi=10.1177%2f147470491201000309&partnerID=40&md5=871088badc228e2794f0f276a6fe8ffa","All Open Access, Gold, Green"
"Wang S., Ding L., Yang H., Guo Z., Xie D., Xie C.","An enhanced group search optimizer using generalized opposition-based learning",2012,"Journal of Computational Information Systems",,"https://www.scopus.com/inward/record.uri?eid=2-s2.0-84863731346&partnerID=40&md5=78991652f2970b9b0ea9b15590d306ef",""
"Racine F., Giraldeau L.-A., Patenaude-Monette M., Giroux J.-F.","Evidence of social information on food location in a ring-billed gull colony, but the birds do not use it",2012,"Animal Behaviour","10.1016/j.anbehav.2012.04.028","https://www.scopus.com/inward/record.uri?eid=2-s2.0-84862677004&doi=10.1016%2fj.anbehav.2012.04.028&partnerID=40&md5=6e09a3500b96d25825f78236cb8bc3d0",""
"Schnoell A.V., Fichtel C.","Wild redfronted lemurs (Eulemur rufifrons) use social information to learn new foraging techniques",2012,"Animal Cognition","10.1007/s10071-012-0477-y","https://www.scopus.com/inward/record.uri?eid=2-s2.0-84862616970&doi=10.1007%2fs10071-012-0477-y&partnerID=40&md5=a457cc253483c05a93f4603e1dab945f","All Open Access, Hybrid Gold, Green"
"Gavrilets S.","Human origins and the transition from promiscuity to pair-bonding",2012,"Proceedings of the National Academy of Sciences of the United States of America","10.1073/pnas.1200717109","https://www.scopus.com/inward/record.uri?eid=2-s2.0-84862517918&doi=10.1073%2fpnas.1200717109&partnerID=40&md5=5d9b3c02b80651746590d196f3642944","All Open Access, Bronze, Green"
"Wells V.K.","Foraging: An ecology model of consumer behaviour?",2012,"Marketing Theory","10.1177/1470593112441562","https://www.scopus.com/inward/record.uri?eid=2-s2.0-84862997538&doi=10.1177%2f1470593112441562&partnerID=40&md5=f10f5cab707f85d837469fe400acb13f","All Open Access, Green"
"Bazazi S., Pfennig K.S., Handegard N.O., Couzin I.D.","Vortex formation and foraging in polyphenic spadefoot toad tadpoles",2012,"Behavioral Ecology and Sociobiology","10.1007/s00265-012-1336-1","https://www.scopus.com/inward/record.uri?eid=2-s2.0-84861227087&doi=10.1007%2fs00265-012-1336-1&partnerID=40&md5=36040db46c013d6b2498292029bf0269","All Open Access, Green"
"Pays O., Blanchard P., Valeix M., Chamaillé-Jammes S., Duncan P., Périquet S., Lombard M., Ncube G., Tarakini T., Makuwe E., Fritz H.","Detecting predators and locating competitors while foraging: An experimental study of a medium-sized herbivore in an African savanna",2012,"Oecologia","10.1007/s00442-011-2218-3","https://www.scopus.com/inward/record.uri?eid=2-s2.0-84861202958&doi=10.1007%2fs00442-011-2218-3&partnerID=40&md5=ce1dd3a5ae950db0fe4382385559aa94",""
"Aoki K., Wakano J.Y., Lehmann L.","Evolutionarily stable learning schedules and cumulative culture in discrete generation models",2012,"Theoretical Population Biology","10.1016/j.tpb.2012.01.006","https://www.scopus.com/inward/record.uri?eid=2-s2.0-84859270358&doi=10.1016%2fj.tpb.2012.01.006&partnerID=40&md5=ed43e0b858bc01d97bccc3b5be5c0ea4","All Open Access, Green"
"Dubois F., Giraldeau L.-A., Réale D.","Frequency-dependent payoffs and sequential decision-making favour consistent tactic use",2012,"Proceedings of the Royal Society B: Biological Sciences","10.1098/rspb.2011.2342","https://www.scopus.com/inward/record.uri?eid=2-s2.0-84859386759&doi=10.1098%2frspb.2011.2342&partnerID=40&md5=7a86380b3ef5b050d5d1209e8040e3ca","All Open Access, Bronze, Green"
"Yeaman S., Schick A., Lehmann L.","Social network architecture and the maintenance of deleterious cultural traits",2012,"Journal of the Royal Society Interface","10.1098/rsif.2011.0555","https://www.scopus.com/inward/record.uri?eid=2-s2.0-84860721649&doi=10.1098%2frsif.2011.0555&partnerID=40&md5=a0ed36324a796a1c6073f6a8d56a777b","All Open Access, Green"
"Kobayashi Y., Wakano J.Y.","Evolution of social versus individual learning in an infinite island model",2012,"Evolution","10.1111/j.1558-5646.2011.01541.x","https://www.scopus.com/inward/record.uri?eid=2-s2.0-84860194694&doi=10.1111%2fj.1558-5646.2011.01541.x&partnerID=40&md5=a442f61be913a3cb5d03e90ec28354af",""
"Berger-Tal O., Avgar T.","The glass is half-full: Overestimating the quality of a novel environment is advantageous",2012,"PLoS ONE","10.1371/journal.pone.0034578","https://www.scopus.com/inward/record.uri?eid=2-s2.0-84859245740&doi=10.1371%2fjournal.pone.0034578&partnerID=40&md5=2bba5a04c93895ea3f5cfd304a5016d3","All Open Access, Gold, Green"
"Acerbi A., Jacquet P.O., Tennie C.","Behavioral constraints and the evolution of faithful social learning",2012,"Current Zoology","10.1093/czoolo/58.2.307","https://www.scopus.com/inward/record.uri?eid=2-s2.0-84862700917&doi=10.1093%2fczoolo%2f58.2.307&partnerID=40&md5=0c8b367badf6bd9bff64f2c39a5b750f","All Open Access, Gold, Green"
"Tucker B.","Do risk and time experimental choices represent individual strategies for coping with poverty or conformity to social norms?, Evidence from Rural Southwestern Madagascar",2012,"Current Anthropology","10.1086/664569","https://www.scopus.com/inward/record.uri?eid=2-s2.0-84859129988&doi=10.1086%2f664569&partnerID=40&md5=f69627c6f702ebfb8f53ed966c9ee4fd",""
"Li Y., Wen Q., Zhang B.","Chaotic ant swarm optimization with passive congregation",2012,"Nonlinear Dynamics","10.1007/s11071-011-0209-x","https://www.scopus.com/inward/record.uri?eid=2-s2.0-84858698892&doi=10.1007%2fs11071-011-0209-x&partnerID=40&md5=37a8865ed7f0b2f313408af665366ccb",""
"Moore J.A., Kamarainen A.M., Scribner K.T., Mykut C., Prince H.H.","The effects of anthropogenic alteration of nesting habitat on rates of extra-pair fertilization and intraspecific brood parasitism in Canada Geese Branta canadensis",2012,"Ibis","10.1111/j.1474-919X.2011.01203.x","https://www.scopus.com/inward/record.uri?eid=2-s2.0-84858293814&doi=10.1111%2fj.1474-919X.2011.01203.x&partnerID=40&md5=d99d79b3b3ba5f914184914b64636da1",""
"David M., Auclair Y., Giraldeau L.-A., Cézilly F.","Personality and body condition have additive effects on motivation to feed in Zebra Finches Taeniopygia guttata",2012,"Ibis","10.1111/j.1474-919X.2012.01216.x","https://www.scopus.com/inward/record.uri?eid=2-s2.0-84858282467&doi=10.1111%2fj.1474-919X.2012.01216.x&partnerID=40&md5=10d255ce0e514fff9fdb74fa2db41e48",""
"Galef B.G.","Social Learning: Promoter or Inhibitor of Innovation?",2012,"Animal Innovation","10.1093/acprof:oso/9780198526223.003.0006","https://www.scopus.com/inward/record.uri?eid=2-s2.0-84921259556&doi=10.1093%2facprof%3aoso%2f9780198526223.003.0006&partnerID=40&md5=4b2a9a68caa8a1f821ed48f04a8a8240",""
"Box H.O.","Characteristics and Propensities of Marmosets and Tamarins: Implications for Studies of Innovation",2012,"Animal Innovation","10.1093/acprof:oso/9780198526223.003.0009","https://www.scopus.com/inward/record.uri?eid=2-s2.0-84921259379&doi=10.1093%2facprof%3aoso%2f9780198526223.003.0009&partnerID=40&md5=be81ae02f571864687edd72970f46d68",""
"Ward A.J.W., Krause J., Sumpter D.J.T.","Quorum decision-making in foraging fish shoals",2012,"PLoS ONE","10.1371/journal.pone.0032411","https://www.scopus.com/inward/record.uri?eid=2-s2.0-84857831741&doi=10.1371%2fjournal.pone.0032411&partnerID=40&md5=1cc1b7b9b4934c0e5b9c0357831978c2","All Open Access, Gold, Green"
"Duda N., Chȩtnicki W.","Conspecific brood parasitism is biased towards relatives in the Common Black-headed Gull",2012,"Ardea","10.5253/078.100.0110","https://www.scopus.com/inward/record.uri?eid=2-s2.0-84862010083&doi=10.5253%2f078.100.0110&partnerID=40&md5=44494376cc311a63ab452a0e5df71df5","All Open Access, Bronze"
"Behney A.C., Grisham B.A., Boal C.W., Whitlaw H.A., Haukos D.A.","Sexual selection and mating chronology of lesser prairie-chickens",2012,"Wilson Journal of Ornithology","10.1676/11-079.1","https://www.scopus.com/inward/record.uri?eid=2-s2.0-84858148419&doi=10.1676%2f11-079.1&partnerID=40&md5=7727ddbe6b84651d7ef8806621a9baed",""
"Lonnstedt O.M., McCormick M.I., Chivers D.P.","Well-informed foraging: Damage-released chemical cues of injured prey signal quality and size to predators",2012,"Oecologia","10.1007/s00442-011-2116-8","https://www.scopus.com/inward/record.uri?eid=2-s2.0-84856770096&doi=10.1007%2fs00442-011-2116-8&partnerID=40&md5=4351a74816f54df60f15621bce685a5b",""
"Zare K., Haque M.T., Davoodi E.","Solving non-convex economic dispatch problem with valve point effects using modified group search optimizer method",2012,"Electric Power Systems Research","10.1016/j.epsr.2011.10.004","https://www.scopus.com/inward/record.uri?eid=2-s2.0-80755184771&doi=10.1016%2fj.epsr.2011.10.004&partnerID=40&md5=31d08498cd00abc1d56e26112e0d9862",""
"Sirot E., Maes P., Gélinaud G.","Movements and Conflicts in a Flock of Foraging Black-Tailed Godwits (Limosa limosa): The Influence of Feeding Rates on Behavioural Decisions",2012,"Ethology","10.1111/j.1439-0310.2011.01995.x","https://www.scopus.com/inward/record.uri?eid=2-s2.0-84855341015&doi=10.1111%2fj.1439-0310.2011.01995.x&partnerID=40&md5=102405fafa96d83d4ec0ce878468268f",""
"Chen D., Wang J., Zou F., Hou W., Zhao C.","An improved group search optimizer with operation of quantum-behaved swarm and its application",2012,"Applied Soft Computing Journal","10.1016/j.asoc.2011.10.021","https://www.scopus.com/inward/record.uri?eid=2-s2.0-84655169227&doi=10.1016%2fj.asoc.2011.10.021&partnerID=40&md5=e567128fcc46a813570fd22b254a90ef",""
"Zhan J., Guo C., Wu Q., Wen B.","Fast group search optimizer and its application to the economic dispatch of power systems",2012,"Zhongguo Dianji Gongcheng Xuebao/Proceedings of the Chinese Society of Electrical Engineering",,"https://www.scopus.com/inward/record.uri?eid=2-s2.0-84874516256&partnerID=40&md5=888dd12e15f72451c459f12b2604400d",""
"Van Dyken J.D., Wade M.J.","Origins of altruism diversity II: Runaway coevolution of altruistic strategies via ""reciprocal niche construction""",2012,"Evolution","10.1111/j.1558-5646.2012.01629.x","https://www.scopus.com/inward/record.uri?eid=2-s2.0-84864310351&doi=10.1111%2fj.1558-5646.2012.01629.x&partnerID=40&md5=c67571697ed72c7b5b5066b66c531c8c","All Open Access, Bronze, Green"
"Cui Z., Shi Z., Abonyi J., he S., Cooper H.J., Ward D., Yao X., Heath J.K.","Analysis of premalignant pancreatic cancer mass spectrometry data for biomarker selection using a group search optimizer",2012,"Transactions of the Institute of Measurement and Control","10.1177/0142331211402893","https://www.scopus.com/inward/record.uri?eid=2-s2.0-84864221517&doi=10.1177%2f0142331211402893&partnerID=40&md5=277dec4074aa66070af6d69453a87723",""
"Zhu Z.","Using QIGSO with steepest gradient descent strategy to direct orbits of chaotic systems",2012,"International Journal of Computational Science and Engineering","10.1504/IJCSE.2012.048091","https://www.scopus.com/inward/record.uri?eid=2-s2.0-84864182684&doi=10.1504%2fIJCSE.2012.048091&partnerID=40&md5=99e3334921ca5ea2b9bb3eff91372c99",""
"Lewis H.M., Laland K.N.","Transmission fidelity is the key to the build-up of cumulative culture",2012,"Philosophical Transactions of the Royal Society B: Biological Sciences","10.1098/rstb.2012.0119","https://www.scopus.com/inward/record.uri?eid=2-s2.0-84863437110&doi=10.1098%2frstb.2012.0119&partnerID=40&md5=01b56aab51a25a672db35034391de814","All Open Access, Bronze, Green"
"Faust L., De Cock R., Lewis S.","Thieves in the night: Kleptoparasitism by fireflies in the genus Photuris dejean (Coleoptera: Lampyridae)",2012,"Coleopterists Bulletin","10.1649/072.066.0101","https://www.scopus.com/inward/record.uri?eid=2-s2.0-84858403389&doi=10.1649%2f072.066.0101&partnerID=40&md5=be3d2f5e1c196f60afc22e2baa7d74fa",""
"Katsnelson E., Motro U., Feldman M.W., Lotem A.","Evolution of learned strategy choice in a frequency-dependent game",2012,"Proceedings of the Royal Society B: Biological Sciences","10.1098/rspb.2011.1734","https://www.scopus.com/inward/record.uri?eid=2-s2.0-84856790601&doi=10.1098%2frspb.2011.1734&partnerID=40&md5=96927721b5684cea19e754565d857188","All Open Access, Green"
"Morgan T.J.H., Rendell L.E., Ehn M., Hoppitt W., Laland K.N.","The evolutionary basis of human social learning",2012,"Proceedings of the Royal Society B: Biological Sciences","10.1098/rspb.2011.1172","https://www.scopus.com/inward/record.uri?eid=2-s2.0-84855668878&doi=10.1098%2frspb.2011.1172&partnerID=40&md5=275cb5d3415cac78c643cb02eab9893e","All Open Access, Green"
"David M., Giraldeau L.-A.","Zebra finches in poor condition produce more and consume more food in a producer-scrounger game",2012,"Behavioral Ecology","10.1093/beheco/arr171","https://www.scopus.com/inward/record.uri?eid=2-s2.0-84555204625&doi=10.1093%2fbeheco%2farr171&partnerID=40&md5=31d9991debc7490b175fcdbdba18b905","All Open Access, Bronze"
"Kurvers R.H.J.M., Van Santen De Hoog S.I., Van Wieren S.E., Ydenberg R.C., Prins H.H.T.","No evidence for negative frequency-dependent feeding performance in relation to personality",2012,"Behavioral Ecology","10.1093/beheco/arr148","https://www.scopus.com/inward/record.uri?eid=2-s2.0-84555170618&doi=10.1093%2fbeheco%2farr148&partnerID=40&md5=5aa837a36df2be4b17c500f3e54f8f58",""
"Mateos-Gonzalez F., Senar J.C.","Melanin-based trait predicts individual exploratory behaviour in siskins, Carduelis spinus",2012,"Animal Behaviour","10.1016/j.anbehav.2011.10.030","https://www.scopus.com/inward/record.uri?eid=2-s2.0-83555164597&doi=10.1016%2fj.anbehav.2011.10.030&partnerID=40&md5=4a6f0547ada0e25e8061a45b6666f8d7",""
"Scharf I., Ovadia O., Foitzik S.","The advantage of alternative tactics of prey and predators depends on the spatial pattern of prey and social interactions among predators",2012,"Population Ecology","10.1007/s10144-011-0286-1","https://www.scopus.com/inward/record.uri?eid=2-s2.0-83355169621&doi=10.1007%2fs10144-011-0286-1&partnerID=40&md5=6c69a81e4d796858299f52c7f37b5c55",""
"Liu F., Li L., Yuan B.","Multi-objective optimal design of frame structures with group search optimizer",2012,"Applied Mechanics and Materials","10.4028/www.scientific.net/AMM.121-126.968","https://www.scopus.com/inward/record.uri?eid=2-s2.0-81255186950&doi=10.4028%2fwww.scientific.net%2fAMM.121-126.968&partnerID=40&md5=2359680e630236fb411ede40ab4911ce",""
"Shen H., Zhu Y., Zou W., Zhu Z.","Group search optimizer algorithm for constrained optimization",2011,"Communications in Computer and Information Science","10.1007/978-3-642-22691-5_9","https://www.scopus.com/inward/record.uri?eid=2-s2.0-84055199299&doi=10.1007%2f978-3-642-22691-5_9&partnerID=40&md5=45f5eabe9b1c362a16d413eb5d83f67f",""
"Silva D.N.G., Pacifico L.D.S., Ludermir T.B.","Improved group search optimizer based on cooperation among groups for feedforward networks training with weight decay",2011,"Conference Proceedings - IEEE International Conference on Systems, Man and Cybernetics","10.1109/ICSMC.2011.6083987","https://www.scopus.com/inward/record.uri?eid=2-s2.0-83755206516&doi=10.1109%2fICSMC.2011.6083987&partnerID=40&md5=ef88f35815bbd717566e6d5292e26d5c",""
"Hardy-Vallée B.","Decision making in the economy of nature: Value as information",2011,"Information and Living Systems: Philosophical and Scientific Perspectives",,"https://www.scopus.com/inward/record.uri?eid=2-s2.0-84894858496&partnerID=40&md5=b82f476220f5914b13d28f4aa0db39e0",""
"Toelch U., Bruce M.J., Meeus M.T.H., Reader S.M.","Social performance cues induce behavioral flexibility in humans",2011,"Frontiers in Psychology","10.3389/fpsyg.2011.00160","https://www.scopus.com/inward/record.uri?eid=2-s2.0-84863811666&doi=10.3389%2ffpsyg.2011.00160&partnerID=40&md5=0e094efdf7175d08e0b8c85c0be61003","All Open Access, Gold, Green"
"Ogura Y., Matsushima T.","Social facilitation revisited: Increase in foraging efforts and synchronization of running in domestic chicks",2011,"Frontiers in Neuroscience","10.3389/fnins.2011.00091","https://www.scopus.com/inward/record.uri?eid=2-s2.0-84861914138&doi=10.3389%2ffnins.2011.00091&partnerID=40&md5=ae81e92a6e625983555089ee6006d504","All Open Access, Gold, Green"
"Soleya F.G., Jackson R.R., Taylor P.W.","Biology of Stenolemus giraffa (Hemiptera: Reduviidae), a web invading, araneophagic assassin bug from Australia",2011,"New Zealand Journal of Zoology","10.1080/03014223.2011.604092","https://www.scopus.com/inward/record.uri?eid=2-s2.0-83455179084&doi=10.1080%2f03014223.2011.604092&partnerID=40&md5=347d693a8713422e2939d6f3b0ab155f","All Open Access, Bronze"
"Eadie J.M., Lyon B.E.","The relative role of relatives in conspecific brood parasitism",2011,"Molecular Ecology","10.1111/j.1365-294X.2011.05320.x","https://www.scopus.com/inward/record.uri?eid=2-s2.0-82955213412&doi=10.1111%2fj.1365-294X.2011.05320.x&partnerID=40&md5=2373d5b77039e71e7a9e0fc9ba8a970e","All Open Access, Bronze"
"King A.J., Sueur C., Huchard E., Cowlishaw G.","A rule-of-thumb based on social affiliation explains collective movements in desert baboons",2011,"Animal Behaviour","10.1016/j.anbehav.2011.09.017","https://www.scopus.com/inward/record.uri?eid=2-s2.0-82355190248&doi=10.1016%2fj.anbehav.2011.09.017&partnerID=40&md5=fc7301bd4fca418ca74150612832cdae",""
"Arbilly M., Motro U., Feldman M.W., Lotem A.","Recombination and the evolution of coordinated phenotypic expression in a frequency-dependent game",2011,"Theoretical Population Biology","10.1016/j.tpb.2011.09.001","https://www.scopus.com/inward/record.uri?eid=2-s2.0-81155139598&doi=10.1016%2fj.tpb.2011.09.001&partnerID=40&md5=ea2874fc549059cf11960d68fc6dde5d","All Open Access, Green"
"Mathot K.J., Van den Hout P.J., Piersma T., Kempenaers B., Réale D., Dingemanse N.J.","Disentangling the roles of frequency-vs. state-dependence in generating individual differences in behavioural plasticity",2011,"Ecology Letters","10.1111/j.1461-0248.2011.01698.x","https://www.scopus.com/inward/record.uri?eid=2-s2.0-80855148014&doi=10.1111%2fj.1461-0248.2011.01698.x&partnerID=40&md5=a66394898e0d2e3c2c12246d971ec6b2",""
"O'Brien M.J., Bentley R.A.","Stimulated Variation and Cascades: Two Processes in the Evolution of Complex Technological Systems",2011,"Journal of Archaeological Method and Theory","10.1007/s10816-011-9110-7","https://www.scopus.com/inward/record.uri?eid=2-s2.0-80855131482&doi=10.1007%2fs10816-011-9110-7&partnerID=40&md5=35557b19dc1e65abe45f89c59e844a39",""
"Bentley R.A., O'Brien M.J., Ormerod P.","Quality versus mere popularity: A conceptual map for understanding human behavior",2011,"Mind and Society","10.1007/s11299-011-0087-4","https://www.scopus.com/inward/record.uri?eid=2-s2.0-80053919686&doi=10.1007%2fs11299-011-0087-4&partnerID=40&md5=cf4323e63ffdee6a453b2ad898934a43",""
"Van Der Post D.J., Semmann D.","Patch depletion, niche structuring and the evolution of co-operative foraging",2011,"BMC Evolutionary Biology","10.1186/1471-2148-11-335","https://www.scopus.com/inward/record.uri?eid=2-s2.0-81155151515&doi=10.1186%2f1471-2148-11-335&partnerID=40&md5=5fbe2421201e1ed2e63bcdbfce6e364c","All Open Access, Gold, Green"
"Arbilly M., Motro U., Feldman M.W., Lotem A.","Evolution of social learning when high expected payoffs are associated with high risk of failure",2011,"Journal of the Royal Society Interface","10.1098/rsif.2011.0138","https://www.scopus.com/inward/record.uri?eid=2-s2.0-80054751337&doi=10.1098%2frsif.2011.0138&partnerID=40&md5=dc32118b3f176dbf5fa9a50883e54967","All Open Access, Green"
"Davis K.M., Burghardt G.M.","Turtles (Pseudemys nelsoni) Learn About Visual Cues Indicating Food From Experienced Turtles",2011,"Journal of Comparative Psychology","10.1037/a0024784","https://www.scopus.com/inward/record.uri?eid=2-s2.0-83755172206&doi=10.1037%2fa0024784&partnerID=40&md5=cd85440022e8de6e3c3ab4955eee7377",""
"Tan R., Fay N.","Cultural transmission in the laboratory: Agent interaction improves the intergenerational transfer of information",2011,"Evolution and Human Behavior","10.1016/j.evolhumbehav.2011.01.001","https://www.scopus.com/inward/record.uri?eid=2-s2.0-80053572806&doi=10.1016%2fj.evolhumbehav.2011.01.001&partnerID=40&md5=d1418cc2371e07b7538809c68dcbc1c7",""
"Sueur C.","Group decision-making in chacma baboons: Leadership, order and communication during movement",2011,"BMC Ecology","10.1186/1472-6785-11-26","https://www.scopus.com/inward/record.uri?eid=2-s2.0-80054682658&doi=10.1186%2f1472-6785-11-26&partnerID=40&md5=2681559ac0839259b13d63e9cbf9748a","All Open Access, Gold, Green"
"He G., Cui Z., Zeng J.","Group search optimizer with interactive dynamic neighborhood",2011,"Lecture Notes in Computer Science (including subseries Lecture Notes in Artificial Intelligence and Lecture Notes in Bioinformatics)","10.1007/978-3-642-23896-3_25","https://www.scopus.com/inward/record.uri?eid=2-s2.0-80054062286&doi=10.1007%2f978-3-642-23896-3_25&partnerID=40&md5=3a0bbebf41f8cca164bedcae28e87b2d",""
"Morand-Ferron J., Wu G.-M., Giraldeau L.-A.","Persistent individual differences in tactic use in a producer-scrounger game are group dependent",2011,"Animal Behaviour","10.1016/j.anbehav.2011.07.014","https://www.scopus.com/inward/record.uri?eid=2-s2.0-80052765880&doi=10.1016%2fj.anbehav.2011.07.014&partnerID=40&md5=44162ab0933d98f48835eefb53d7edb8",""
"Ward A.J.W., Herbert-Read J.E., Simpson S.J.","Diets and decisions: The potential use of food protein cues in dietary, sexual and social decisions by mosquitofish",2011,"Animal Behaviour","10.1016/j.anbehav.2011.07.010","https://www.scopus.com/inward/record.uri?eid=2-s2.0-80052737223&doi=10.1016%2fj.anbehav.2011.07.010&partnerID=40&md5=49be25535559272d2527ec9b23eb391d",""
"Liu S.-Y., Hedrick K.","The application of domain of danger in autonomous agent team and its effect on exploration efficiency",2011,"Proceedings of the American Control Conference",,"https://www.scopus.com/inward/record.uri?eid=2-s2.0-80053164282&partnerID=40&md5=1141fdbdd54beb2f12e2517dbcdea488",""
"David M., Cézilly F.","Personality may confound common measures of Mate-Choice",2011,"PLoS ONE","10.1371/journal.pone.0024778","https://www.scopus.com/inward/record.uri?eid=2-s2.0-80052842465&doi=10.1371%2fjournal.pone.0024778&partnerID=40&md5=7b549e64ca24429ca85e1d0cdf8e6c05","All Open Access, Gold, Green"
"Dermody B.J., Tanner C.J., Jackson A.L.","The evolutionary pathway to obligate scavenging in gyps vultures",2011,"PLoS ONE","10.1371/journal.pone.0024635","https://www.scopus.com/inward/record.uri?eid=2-s2.0-80052536496&doi=10.1371%2fjournal.pone.0024635&partnerID=40&md5=0111daea37ea1404e7f736a0379f22ab","All Open Access, Gold, Green"
"Griesser M., Ma Q., Webber S., Bowgen K., Sumpter D.J.T.","Understanding animal group-size distributions",2011,"PLoS ONE","10.1371/journal.pone.0023438","https://www.scopus.com/inward/record.uri?eid=2-s2.0-80052301906&doi=10.1371%2fjournal.pone.0023438&partnerID=40&md5=a19dadf62ff53c3b42106f57b9262215","All Open Access, Gold, Green"
"Laland K.N., O’Brien M.J.","Cultural Niche Construction: An Introduction",2011,"Biological Theory","10.1007/s13752-012-0026-6","https://www.scopus.com/inward/record.uri?eid=2-s2.0-85133871662&doi=10.1007%2fs13752-012-0026-6&partnerID=40&md5=98da4b0505a9c7d0951541fd732a8e1e",""
"Deng Q.-X., Wang H.-T., Yao D., Wang X.-Y., Em M.-J., Wang T., Gao W.","Conspecific brood parasitism and nesting biology of Mandarin Ducks (Aix galericulata) in northeastern China",2011,"Wilson Journal of Ornithology","10.1676/10-144.1","https://www.scopus.com/inward/record.uri?eid=2-s2.0-80054932289&doi=10.1676%2f10-144.1&partnerID=40&md5=36901f33574eb1348a322a5810ce44b1",""
"Mesoudi A.","An experimental comparison of human social learning strategies: Payoff-biased social learning is adaptive but underused",2011,"Evolution and Human Behavior","10.1016/j.evolhumbehav.2010.12.001","https://www.scopus.com/inward/record.uri?eid=2-s2.0-79961166766&doi=10.1016%2fj.evolhumbehav.2010.12.001&partnerID=40&md5=5502aa4aaf7b9b6b60f8ce18f569d73e",""
"Silva D.N.G., Pacifico L.D.S., Ludermir T.B.","An evolutionary extreme learning machine based on group search optimization",2011,"2011 IEEE Congress of Evolutionary Computation, CEC 2011","10.1109/CEC.2011.5949670","https://www.scopus.com/inward/record.uri?eid=2-s2.0-80052015366&doi=10.1109%2fCEC.2011.5949670&partnerID=40&md5=070bdfe311b0a95720431cd814c8a019",""
"Ma Q., Johansson A., Sumpter D.J.T.","A first principles derivation of animal group size distributions",2011,"Journal of Theoretical Biology","10.1016/j.jtbi.2011.04.031","https://www.scopus.com/inward/record.uri?eid=2-s2.0-79958031795&doi=10.1016%2fj.jtbi.2011.04.031&partnerID=40&md5=0b4d6a9bed08fc1006e4ec7f24462bf2","All Open Access, Green"
"Both C.","Starlings sturnus vulgaris kleptoparasitising Godwits Limosa spp. [Spreeuwen beroven Grutto's van hun prooien]",2011,"Limosa",,"https://www.scopus.com/inward/record.uri?eid=2-s2.0-80051692177&partnerID=40&md5=5953c50becc93a1c161908f18fed3124",""
"Fang J., Zhong Z., Li W.","A modified GSO based on limited storage Quasi-Newton method",2011,"Journal of Computers","10.4304/jcp.6.8.1613-1620","https://www.scopus.com/inward/record.uri?eid=2-s2.0-80051657147&doi=10.4304%2fjcp.6.8.1613-1620&partnerID=40&md5=f0dee7c2ff01f8b091716797488ae255",""
