Authors,Title,Year,Source title,DOI,Link,Open Access
"Liebhold A.M., Brockerhoff E.G., Kalisz S., Nuñez M.A., Wardle D.A., Wingfield M.J.","Biological invasions in forest ecosystems",2017,"Biological Invasions","10.1007/s10530-017-1458-5","https://www.scopus.com/inward/record.uri?eid=2-s2.0-85028768065&doi=10.1007%2fs10530-017-1458-5&partnerID=40&md5=afe98a9b0a635da5c55c17d316e85fc7",""
"Parthasarathy S., Jothi Venkateswaran C.","Scheduling jobs using oppositional-GSO algorithm in cloud computing environment",2017,"Wireless Networks","10.1007/s11276-016-1264-5","https://www.scopus.com/inward/record.uri?eid=2-s2.0-84969813550&doi=10.1007%2fs11276-016-1264-5&partnerID=40&md5=54781b15bef5411e0f49c4a6b11b6eb2",""
"Ramirez M., Castellanos R., Calderon J.G.","Modified teaching-learning based optimization algorithm and damping of inter-area oscillations through VSC-HVDC",2017,"2017 19th International Conference on Intelligent System Application to Power Systems, ISAP 2017","10.1109/ISAP.2017.8071409","https://www.scopus.com/inward/record.uri?eid=2-s2.0-85039948418&doi=10.1109%2fISAP.2017.8071409&partnerID=40&md5=e3045d2598a182a7587bf209edb627b2",""
"Jones S.","‘Words of Wisdom’: Text, Voice and Justice in I, Daniel Blake",2017,"Changing English: Studies in Culture and Education","10.1080/1358684X.2017.1298990","https://www.scopus.com/inward/record.uri?eid=2-s2.0-85038395869&doi=10.1080%2f1358684X.2017.1298990&partnerID=40&md5=4acd2dff006808c6d1cee44cf4a7a0d0","All Open Access, Green"
"Lyon B.E., Shizuka D.","Context-dependent response to eggs: egg retrieval versus egg rejection in a conspecific brood parasite",2017,"Animal Behaviour","10.1016/j.anbehav.2017.08.022","https://www.scopus.com/inward/record.uri?eid=2-s2.0-85029718524&doi=10.1016%2fj.anbehav.2017.08.022&partnerID=40&md5=10595e893102f4303320f6527e7a678b","All Open Access, Bronze"
"Oudman T., Goeij P.D., Piersma T., Lok T.","Colony-Breeding Eurasian Spoonbills in the Netherlands: Local Limits to Population Growth with Expansion into New Areas",2017,"Ardea","10.5253/arde.v105i2.a2","https://www.scopus.com/inward/record.uri?eid=2-s2.0-85028880720&doi=10.5253%2farde.v105i2.a2&partnerID=40&md5=2c31551e4c3f267a30a5c5649af13b63","All Open Access, Green"
"Saharan S., Lather J.S., Radhakrishnan R.","Combinatorial problem optimization using TLBO",2017,"4th IEEE International Conference on Signal Processing, Computing and Control, ISPCC 2017","10.1109/ISPCC.2017.8269741","https://www.scopus.com/inward/record.uri?eid=2-s2.0-85045834199&doi=10.1109%2fISPCC.2017.8269741&partnerID=40&md5=a2bf0f92b71df819b4c0e611f8fac81c",""
"Sosis R.","The emergence and stability of cooperative fishing on Ifaluk Atoll",2017,"Adaptation and Human Behavior: An Anthropological Perspective",,"https://www.scopus.com/inward/record.uri?eid=2-s2.0-85070685474&partnerID=40&md5=e5f2bb8e6141abf31e756e70b1d08fdf",""
"Van Cleve J.","Stags, hawks, and doves: Social evolution theory and individual variation in cooperation",2017,"Integrative and Comparative Biology","10.1093/icb/icx071","https://www.scopus.com/inward/record.uri?eid=2-s2.0-85043721307&doi=10.1093%2ficb%2ficx071&partnerID=40&md5=9bdacf1d37d82c2e0197a5278321d139","All Open Access, Green"
"Prajindra Sankar K., Kiong T.S., Siaw Paw J.K.","Dynamic social behavior algorithm for real-parameter optimization problems and optimization of hyper beamforming of linear antenna arrays",2017,"Engineering Applications of Artificial Intelligence","10.1016/j.engappai.2017.06.027","https://www.scopus.com/inward/record.uri?eid=2-s2.0-85026397516&doi=10.1016%2fj.engappai.2017.06.027&partnerID=40&md5=2b9526126de4d360e17c75e13fcb938f",""
"van Nieuwamerongen S.E., Mendl M., Held S., Soede N.M., Bolhuis J.E.","Post-weaning social and cognitive performance of piglets raised pre-weaning either in a complex multi-suckling group housing system or in a conventional system with a crated sow",2017,"Animal Cognition","10.1007/s10071-017-1110-x","https://www.scopus.com/inward/record.uri?eid=2-s2.0-85021807971&doi=10.1007%2fs10071-017-1110-x&partnerID=40&md5=990de2c08817700d1ce16d074a0231f2","All Open Access, Hybrid Gold, Green"
"Benhaïm D., Ferrari S., Colchen T., Chatain B., Bégout M.-L.","Relationship between individual and group learning in a marine teleost: A case study with sea bass under self-feeding conditions",2017,"Learning and Behavior","10.3758/s13420-017-0266-1","https://www.scopus.com/inward/record.uri?eid=2-s2.0-85017001738&doi=10.3758%2fs13420-017-0266-1&partnerID=40&md5=87de3583547764f34380350b687d7a0f","All Open Access, Bronze, Green"
"Put J.E., Put L., Clair C.C.St.","Caching behaviour by red squirrels may contribute to food conditioning of grizzly bears",2017,"Nature Conservation","10.3897/natureconservation.21.12429","https://www.scopus.com/inward/record.uri?eid=2-s2.0-85029176922&doi=10.3897%2fnatureconservation.21.12429&partnerID=40&md5=7121c9610a1820d0bf929ef58dc73e0f","All Open Access, Gold, Green"
"White D.J., Davies H.B., Agyapong S., Seegmiller N.","Nest prospecting brown-headed cowbirds ‘parasitize’ social information when the value of personal information is lacking",2017,"Proceedings of the Royal Society B: Biological Sciences","10.1098/rspb.2017.1083","https://www.scopus.com/inward/record.uri?eid=2-s2.0-85028296018&doi=10.1098%2frspb.2017.1083&partnerID=40&md5=50d4234ddbe17cd5336bb9f5cface80b","All Open Access, Green"
"O'Brien M.J., Bentley R.A.","Dual Inheritance, Cultural Transmission, and Niche Construction",2017,"The Handbook of Culture and Biology Interplay","10.1002/9781119181361.ch8","https://www.scopus.com/inward/record.uri?eid=2-s2.0-85049760758&doi=10.1002%2f9781119181361.ch8&partnerID=40&md5=3baad2d223a27ad621d583ab8d3efece",""
"Lihoreau M., Charleston M.A., Senior A.M., Clissold F.J., Raubenheimer D., Simpson S.J., Buhl J.","Collective foraging in spatially complex nutritional environments",2017,"Philosophical Transactions of the Royal Society B: Biological Sciences","10.1098/rstb.2016.0238","https://www.scopus.com/inward/record.uri?eid=2-s2.0-85021812091&doi=10.1098%2frstb.2016.0238&partnerID=40&md5=ae60cb0c3a2cb558d24005b1b0db9a87","All Open Access, Bronze, Green"
"Delgado M.M., Sulloway F.J.","Attributes of conscientiousness throughout the animal kingdom: An empirical and evolutionary overview",2017,"Psychological Bulletin","10.1037/bul0000107","https://www.scopus.com/inward/record.uri?eid=2-s2.0-85026393547&doi=10.1037%2fbul0000107&partnerID=40&md5=b1f59c899057de1e041bd445ed1fcac0","All Open Access, Bronze"
"White D.J., Watts E., Pitchforth K., Agyapong S., Miller N.","‘Sociability’ affects the intensity of mate-choice copying in female guppies, Poecilia reticulata",2017,"Behavioural Processes","10.1016/j.beproc.2017.02.017","https://www.scopus.com/inward/record.uri?eid=2-s2.0-85014352821&doi=10.1016%2fj.beproc.2017.02.017&partnerID=40&md5=3f3fe2898128b3e761c35e1d5b9a02ef",""
"Lilley M.K., Kuczaj S.A., Yeater D.B.","Individual differences in nonhuman animals: Examining boredom, curiosity, and creativity",2017,"Personality in Nonhuman Animals","10.1007/978-3-319-59300-5_13","https://www.scopus.com/inward/record.uri?eid=2-s2.0-85043380013&doi=10.1007%2f978-3-319-59300-5_13&partnerID=40&md5=bd4d2e64fd430925dd108bf927579466",""
"Creanza N., Kolodny O., Feldman M.W.","Cultural evolutionary theory: How culture evolves and why it matters",2017,"Proceedings of the National Academy of Sciences of the United States of America","10.1073/pnas.1620732114","https://www.scopus.com/inward/record.uri?eid=2-s2.0-85025843300&doi=10.1073%2fpnas.1620732114&partnerID=40&md5=3eedf39b77091573855c5b63204c6e57","All Open Access, Bronze, Green"
"Chalk D., Manzi S., Britten N., Kluettgens B., Magura R., Valderas J.","Can agent-based simulation be used as a tool to support polypharmacy prescribing practice?",2017,"BMJ Simulation and Technology Enhanced Learning","10.1136/bmjstel-2016-000162","https://www.scopus.com/inward/record.uri?eid=2-s2.0-85065926774&doi=10.1136%2fbmjstel-2016-000162&partnerID=40&md5=828c153f614dee1af99b0be964502d49","All Open Access, Green"
"Lambie-Mumford H.","Hungry Britain: The rise of food charity",2017,"Hungry Britain: The Rise of Food Charity",,"https://www.scopus.com/inward/record.uri?eid=2-s2.0-85040586520&partnerID=40&md5=c6140534178c799d762c34144b09c010",""
"Vardi R., Abramsky Z., Kotler B.P., Altstein O., Rosenzweig M.L.","How does the presence of a conspecific individual change the behavioral game that a predator plays with its prey?",2017,"Oecologia","10.1007/s00442-017-3884-6","https://www.scopus.com/inward/record.uri?eid=2-s2.0-85019588688&doi=10.1007%2fs00442-017-3884-6&partnerID=40&md5=540267c54be5be9fdc0dd06fe7099f4d",""
"Xin Q., Ogura Y., Matsushima T.","Four eyes match better than two: Sharing of precise patch-use time among socially foraging domestic chicks",2017,"Behavioural Processes","10.1016/j.beproc.2017.04.020","https://www.scopus.com/inward/record.uri?eid=2-s2.0-85018766407&doi=10.1016%2fj.beproc.2017.04.020&partnerID=40&md5=8f2042c67b97283a34cadc72c422f094","All Open Access, Green"
"Moran N.P., Wong B.B.M., Thompson R.M.","Weaving animal temperament into food webs: implications for biodiversity",2017,"Oikos","10.1111/oik.03642","https://www.scopus.com/inward/record.uri?eid=2-s2.0-85018381877&doi=10.1111%2foik.03642&partnerID=40&md5=f68291fb99b81dd6af1a6071fd199a6c","All Open Access, Green"
"Naselli M., Biondi A., Tropea Garzia G., Desneux N., Russo A., Siscaro G., Zappalà L.","Insights into food webs associated with the South American tomato pinworm",2017,"Pest Management Science","10.1002/ps.4562","https://www.scopus.com/inward/record.uri?eid=2-s2.0-85016950343&doi=10.1002%2fps.4562&partnerID=40&md5=0687d47d9da1ded3c36b6f847100284c",""
"Kane A., Kendall C.J.","Understanding how mammalian scavengers use information from avian scavengers: cue from above",2017,"Journal of Animal Ecology","10.1111/1365-2656.12663","https://www.scopus.com/inward/record.uri?eid=2-s2.0-85015251692&doi=10.1111%2f1365-2656.12663&partnerID=40&md5=c81633d8164964962d818dc17f20beeb","All Open Access, Bronze"
"Zhai J., Zhang H., Hu G., He G., You L.","A novel intelligent service selection method for third-party IT service",2017,"PIC 2016 - Proceedings of the 2016 IEEE International Conference on Progress in Informatics and Computing","10.1109/PIC.2016.7949578","https://www.scopus.com/inward/record.uri?eid=2-s2.0-85025170896&doi=10.1109%2fPIC.2016.7949578&partnerID=40&md5=25eaab94861f598cdc11a6c1f97bf25b",""
"Ohtsuki H., Wakano J.Y., Kobayashi Y.","Inclusive fitness analysis of cumulative cultural evolution in an island-structured population",2017,"Theoretical Population Biology","10.1016/j.tpb.2017.03.001","https://www.scopus.com/inward/record.uri?eid=2-s2.0-85016295200&doi=10.1016%2fj.tpb.2017.03.001&partnerID=40&md5=059497ea36962fe2ea16a0f3b356122b",""
"Bi X.-J., Wang J.-H.","Teaching-learning-based optimization algorithm with hybrid learning strategy",2017,"Zhejiang Daxue Xuebao (Gongxue Ban)/Journal of Zhejiang University (Engineering Science)","10.3785/j.issn.1008-973X.2017.05.024","https://www.scopus.com/inward/record.uri?eid=2-s2.0-85025477355&doi=10.3785%2fj.issn.1008-973X.2017.05.024&partnerID=40&md5=20d98464137b4ef09ddd8e8dc07d49ed",""
"Goodale E., Beauchamp G., Ruxton G.D.","Mixed-Species Groups of Animals: Behavior, Community Structure, and Conservation",2017,"Mixed-Species Groups of Animals: Behavior, Community Structure, and Conservation",,"https://www.scopus.com/inward/record.uri?eid=2-s2.0-85040607831&partnerID=40&md5=f7e3936afbe60e81f95471f280a711ab",""
"Farine D.R., Strandburg-Peshkin A., Couzin I.D., Berger-Wolf T.Y., Crofoot M.C.","Individual variation in local interaction rules can explain emergent patterns of spatial organization in wild baboons",2017,"Proceedings of the Royal Society B: Biological Sciences","10.1098/rspb.2016.2243","https://www.scopus.com/inward/record.uri?eid=2-s2.0-85019129803&doi=10.1098%2frspb.2016.2243&partnerID=40&md5=416fd746862ebea568c542114f2af9da","All Open Access, Hybrid Gold, Green"
"Harel R., Spiegel O., Getz W.M., Nathan R.","Social foraging and individual consistency in following behaviour: Testing the information centre hypothesis in free-ranging vultures",2017,"Proceedings of the Royal Society B: Biological Sciences","10.1098/rspb.2016.2654","https://www.scopus.com/inward/record.uri?eid=2-s2.0-85017538145&doi=10.1098%2frspb.2016.2654&partnerID=40&md5=d5455ac0cb2f1b3f5774f2a1c5a121fa","All Open Access, Bronze, Green"
"Aplin L.M., Morand-Ferron J.","Stable producer–scrounger dynamics in wild birds: Sociability and learning speed covary with scrounging behaviour",2017,"Proceedings of the Royal Society B: Biological Sciences","10.1098/rspb.2016.2872","https://www.scopus.com/inward/record.uri?eid=2-s2.0-85017527858&doi=10.1098%2frspb.2016.2872&partnerID=40&md5=b32146a4b54e0c00cb428c63e9c1ad84","All Open Access, Hybrid Gold, Green"
"Gillung J.P., Borkent C.J.","Death comes on two wings: A review of dipteran natural enemies of arachnids",2017,"Journal of Arachnology","10.1636/JoA-S-16-085.1","https://www.scopus.com/inward/record.uri?eid=2-s2.0-85016439359&doi=10.1636%2fJoA-S-16-085.1&partnerID=40&md5=852db3e747278325cf8e171861e400ee","All Open Access, Green"
"Liu J., Ma D., Ma T.-B., Zhang W.","Ecosystem particle swarm optimization",2017,"Soft Computing","10.1007/s00500-016-2111-4","https://www.scopus.com/inward/record.uri?eid=2-s2.0-84961618602&doi=10.1007%2fs00500-016-2111-4&partnerID=40&md5=977837efb36e49259f8d0f930f3dd888",""
"Linquist S.","The evolution of culture",2017,"The Evolution of Culture","10.4324/9781315239804","https://www.scopus.com/inward/record.uri?eid=2-s2.0-85129723743&doi=10.4324%2f9781315239804&partnerID=40&md5=2b65b10243e0fdee473593aca9461076",""
"Deng G.-L., Tian G.-D., Gu X.-S.","Multi-objective scheduling for multi-product batch process with no-wait constraint",2017,"Kongzhi yu Juece/Control and Decision","10.13195/j.kzyjc.2015.1503","https://www.scopus.com/inward/record.uri?eid=2-s2.0-85019745331&doi=10.13195%2fj.kzyjc.2015.1503&partnerID=40&md5=535e5a1bb3a62d3c1286910de0314f38",""
"Molero-Baltanás R., Bach De Roca C., Tinaut A., Diz Pérez J., Gaju-Ricart M.","Symbiotic relationships between silverfish (Zygentoma: Lepismatidae, Nicoletiidae) and ants (Hymenoptera: Formicidae) in the Western Palaearctic. A quantitative analysis of data from Spain",2017,"Myrmecological News",,"https://www.scopus.com/inward/record.uri?eid=2-s2.0-85017519117&partnerID=40&md5=271b23dba76fd08ee5ffaf10e6813cbe",""
"González-Forero M., Faulwasser T., Lehmann L.","A model for brain life history evolution",2017,"PLoS Computational Biology","10.1371/journal.pcbi.1005380","https://www.scopus.com/inward/record.uri?eid=2-s2.0-85016820022&doi=10.1371%2fjournal.pcbi.1005380&partnerID=40&md5=798076bea7fbe81abc95422bea4290c7","All Open Access, Gold, Green"
"Toyokawa W.","Scrounging by foragers can resolve the paradox of enrichment",2017,"Royal Society Open Science","10.1098/rsos.160830","https://www.scopus.com/inward/record.uri?eid=2-s2.0-85014616600&doi=10.1098%2frsos.160830&partnerID=40&md5=e75409bac65142d58eac56e0897d1c9b","All Open Access, Gold, Green"
"Wen J., Weng P.","Traveling wave solutions in a diffusive producer-scrounger model",2017,"Discrete and Continuous Dynamical Systems - Series B","10.3934/dcdsb.2017030","https://www.scopus.com/inward/record.uri?eid=2-s2.0-85011826929&doi=10.3934%2fdcdsb.2017030&partnerID=40&md5=4dcc9fad27133cda47514302cf406b72","All Open Access, Bronze"
"Szabo B., Bugnyar T., Auersperg A.M.I.","Within-group relationships and lack of social enhancement during object manipulation in captive Goffin’s cockatoos (Cacatua goffiniana)",2017,"Learning and Behavior","10.3758/s13420-016-0235-0","https://www.scopus.com/inward/record.uri?eid=2-s2.0-84978164207&doi=10.3758%2fs13420-016-0235-0&partnerID=40&md5=79014e0000ef77a61a3ab6e0995fcbbe","All Open Access, Hybrid Gold, Green"
"Truskanov N., Lotem A.","Trial-and-error copying of demonstrated actions reveals how fledglings learn to ‘imitate’ their mothers",2017,"Proceedings of the Royal Society B: Biological Sciences","10.1098/rspb.2016.2744","https://www.scopus.com/inward/record.uri?eid=2-s2.0-85013762868&doi=10.1098%2frspb.2016.2744&partnerID=40&md5=6e2b293f2333e1a1f4de05716730c42c","All Open Access, Bronze, Green"
"Ahmed M.M., Elwaki M.M., Hassanien A.E., Hassanien E.","Discrete group search optimizer for community detection in multidimensional social network",2017,"2016 12th International Computer Engineering Conference, ICENCO 2016: Boundless Smart Societies","10.1109/ICENCO.2016.7856444","https://www.scopus.com/inward/record.uri?eid=2-s2.0-85015979931&doi=10.1109%2fICENCO.2016.7856444&partnerID=40&md5=e4e328bd3a025fab13856d82e3107aa2",""
"Kharratzadeh M., Montrey M., Metz A., Shultz T.R.","Specialized hybrid learners resolve Rogers' paradox about the adaptive value of social learning",2017,"Journal of Theoretical Biology","10.1016/j.jtbi.2016.11.017","https://www.scopus.com/inward/record.uri?eid=2-s2.0-85001004304&doi=10.1016%2fj.jtbi.2016.11.017&partnerID=40&md5=d000de669cefbd04644ee01fe410bbdb",""
"Jena C., Basu M.","Group Search Optimization for Fixed Head Hydrothermal Power System",2017,"Journal of The Institution of Engineers (India): Series B","10.1007/s40031-016-0234-8","https://www.scopus.com/inward/record.uri?eid=2-s2.0-85029784495&doi=10.1007%2fs40031-016-0234-8&partnerID=40&md5=d82a15d1f86433f3b3dc98bdeefead93",""
"Pacifico L.D.S., Ludermir T.B.","Data Clustering Using Group Search Optimization with Alternative Fitness Functions",2017,"Proceedings - 2016 5th Brazilian Conference on Intelligent Systems, BRACIS 2016","10.1109/BRACIS.2016.062","https://www.scopus.com/inward/record.uri?eid=2-s2.0-85015253424&doi=10.1109%2fBRACIS.2016.062&partnerID=40&md5=6672efeb083a2b194dd8ab0a980b496d",""
"Andersson M.","Helping relatives survive and reproduce: inclusive fitness and reproductive value in brood parasitism",2017,"American Naturalist","10.1086/689991","https://www.scopus.com/inward/record.uri?eid=2-s2.0-85010281267&doi=10.1086%2f689991&partnerID=40&md5=039464efbb41c025535acf52eb2256fa",""
"Benhaïm D., Akian D.D., Ramos M., Ferrari S., Yao K., Bégout M.-L.","Self-feeding behaviour and personality traits in tilapia: A comparative study between Oreochromis niloticus and Sarotherodon melanotheron",2017,"Applied Animal Behaviour Science","10.1016/j.applanim.2016.12.004","https://www.scopus.com/inward/record.uri?eid=2-s2.0-85009517397&doi=10.1016%2fj.applanim.2016.12.004&partnerID=40&md5=ae140120ae7200f3aebf4eeea2e5d00f","All Open Access, Green"
"Pagani-Núñez E., Renom M., Mateos-Gonzalez F., Cotín J., Senar J.C.","The diet of great tit nestlings: Comparing observation records and stable isotope analyses",2017,"Basic and Applied Ecology","10.1016/j.baae.2016.11.004","https://www.scopus.com/inward/record.uri?eid=2-s2.0-85008144053&doi=10.1016%2fj.baae.2016.11.004&partnerID=40&md5=9904720b1d0ad1bdba0657c1a8e2ff8c",""
"Breed M.D.","Conceptual Breakthroughs in Ethology and Animal Behavior",2017,"Conceptual Breakthroughs in Ethology and Animal Behavior",,"https://www.scopus.com/inward/record.uri?eid=2-s2.0-85027193975&partnerID=40&md5=3b487a332a2966e3a2528de195a23061",""
"Spencer R., Russell Y.I., Dickins B.J.A., Dickins T.E.","Kleptoparasitism in gulls Laridae at an urban and a coastal foraging environment: an assessment of ecological predictors",2017,"Bird Study","10.1080/00063657.2016.1249821","https://www.scopus.com/inward/record.uri?eid=2-s2.0-84994143464&doi=10.1080%2f00063657.2016.1249821&partnerID=40&md5=ed975ca022e0bc996f7ed8afc5157bcb","All Open Access, Green"
"Stephens D.W., Dunlap A.S.","Foraging",2017,"Learning and Memory: A Comprehensive Reference","10.1016/B978-0-12-809324-5.21014-6","https://www.scopus.com/inward/record.uri?eid=2-s2.0-85069809247&doi=10.1016%2fB978-0-12-809324-5.21014-6&partnerID=40&md5=7395011e7c6cb8493dfd876eaf69e495",""
"Sykes D.G., Rychtář J.","Optimal aggression in kleptoparasitic interactions",2017,"Involve","10.2140/involve.2017.10.735","https://www.scopus.com/inward/record.uri?eid=2-s2.0-85042804283&doi=10.2140%2finvolve.2017.10.735&partnerID=40&md5=1d7cd27cc0477dbe255bdac490034323","All Open Access, Green"
"Akhand M.A.H., Peya Z.J., Sultana T., Rahman M.M.H.","Solving capacitated vehicle routing problem using variant sweep and swarm intelligence",2017,"Journal of Applied Science and Engineering","10.6180/jase.2017.20.4.13","https://www.scopus.com/inward/record.uri?eid=2-s2.0-85040131832&doi=10.6180%2fjase.2017.20.4.13&partnerID=40&md5=6dd9df84d677a67030a305ad19b9254b",""
"Hasenjager M.J., Dugatkin L.A.","Familiarity affects network structure and information flow in guppy (Poecilia reticulata) shoals",2017,"Behavioral Ecology","10.1093/BEHECO/ARW152","https://www.scopus.com/inward/record.uri?eid=2-s2.0-85030858907&doi=10.1093%2fBEHECO%2fARW152&partnerID=40&md5=41f3bff9f93a86ea78e7fee35133163b","All Open Access, Bronze"
"Miyashita T., Kasada M., Tanikawa A.","Experimental evidence that high humidity is an essential cue for web building in Pasilobus spiders",2017,"Behaviour","10.1163/1568539X-00003440","https://www.scopus.com/inward/record.uri?eid=2-s2.0-85029819493&doi=10.1163%2f1568539X-00003440&partnerID=40&md5=d7de022c6de59379494ec012929e7607",""
"Lee A.E.G., Cowlishaw G.","Switching spatial scale reveals dominance-dependent social foraging tactics in a wild primate",2017,"PeerJ","10.7717/peerj.3462","https://www.scopus.com/inward/record.uri?eid=2-s2.0-85021690769&doi=10.7717%2fpeerj.3462&partnerID=40&md5=87cbda6c9d9724ab626a6c4e917158d7","All Open Access, Gold, Green"
"Beauchamp G.","The spatial distribution of foragers and food patches can influence antipredator vigilance",2017,"Behavioral Ecology","10.1093/beheco/arw160","https://www.scopus.com/inward/record.uri?eid=2-s2.0-85021327279&doi=10.1093%2fbeheco%2farw160&partnerID=40&md5=3e2a7bde8f17252b1321a0c46f24e326","All Open Access, Bronze"
"Yu K., Chen X., Wang X., Wang Z.","Parameters identification of photovoltaic models using self-adaptive teaching-learning-based optimization",2017,"Energy Conversion and Management","10.1016/j.enconman.2017.04.054","https://www.scopus.com/inward/record.uri?eid=2-s2.0-85018767539&doi=10.1016%2fj.enconman.2017.04.054&partnerID=40&md5=220e2a27897e3903a6be7837979e4d0e",""
"Davoodi E., Zare K., Babaei E.","A GSO-based algorithm for combined heat and power dispatch problem with modified scrounger and ranger operators",2017,"Applied Thermal Engineering","10.1016/j.applthermaleng.2017.03.114","https://www.scopus.com/inward/record.uri?eid=2-s2.0-85016421013&doi=10.1016%2fj.applthermaleng.2017.03.114&partnerID=40&md5=3eeb017bbaf2f15a8df452191944e955",""
"Aoki K., Wakano J.Y., Feldman M.W.","Gene-Culture Models for the Evolution of Altruistic Teaching",2017,"On Human Nature: Biology, Psychology, Ethics, Politics, and Religion","10.1016/B978-0-12-420190-3.00018-1","https://www.scopus.com/inward/record.uri?eid=2-s2.0-85009877508&doi=10.1016%2fB978-0-12-420190-3.00018-1&partnerID=40&md5=6ec4e41a8a699aca803526287cc7e9f5",""
"Zandberg L., Quinn J.L., Naguib M., van Oers K.","Personality-dependent differences in problem-solving performance in a social context reflect foraging strategies",2017,"Behavioural Processes","10.1016/j.beproc.2016.09.007","https://www.scopus.com/inward/record.uri?eid=2-s2.0-85002323047&doi=10.1016%2fj.beproc.2016.09.007&partnerID=40&md5=037241be765f9847f105842f134bf843",""
"Romero-Mujalli D., Cappelletto J., Herrera E.A., Tárano Z.","The effect of social learning in a small population facing environmental change: an agent-based simulation",2017,"Journal of Ethology","10.1007/s10164-016-0490-8","https://www.scopus.com/inward/record.uri?eid=2-s2.0-84983783167&doi=10.1007%2fs10164-016-0490-8&partnerID=40&md5=b65ce28e24ccd652376c7aad6f646e5b",""
"Brust V., Guenther A.","Stability of the guinea pigs personality – cognition – linkage over time",2017,"Behavioural Processes","10.1016/j.beproc.2016.06.009","https://www.scopus.com/inward/record.uri?eid=2-s2.0-84977091169&doi=10.1016%2fj.beproc.2016.06.009&partnerID=40&md5=5dc005a17a30a48055ddba41bb5b93f7",""
"Lardy S., Fortin D., Pays O.","Increased exploration capacity promotes group fission in gregarious foraging herbivores",2016,"PLoS ONE","10.1371/journal.pone.0167516","https://www.scopus.com/inward/record.uri?eid=2-s2.0-85000741756&doi=10.1371%2fjournal.pone.0167516&partnerID=40&md5=6561916b0a9254181ebba753827f7f38","All Open Access, Gold, Green"
"Dawson E.H., Chittka L., Leadbeater E.","Alarm substances induce associative social learning in honeybees, Apis mellifera",2016,"Animal Behaviour","10.1016/j.anbehav.2016.08.006","https://www.scopus.com/inward/record.uri?eid=2-s2.0-84992154382&doi=10.1016%2fj.anbehav.2016.08.006&partnerID=40&md5=148c4a78a07d9ec79f1fb9b08b49a73f","All Open Access, Green"
"Josens R., Mattiacci A., Lois-Milevicich J., Giacometti A.","Food information acquired socially overrides individual food assessment in ants",2016,"Behavioral Ecology and Sociobiology","10.1007/s00265-016-2216-x","https://www.scopus.com/inward/record.uri?eid=2-s2.0-84990842267&doi=10.1007%2fs00265-016-2216-x&partnerID=40&md5=e6ef670302147d918aa8a0e58bfb9657",""
"Wen J., Weng P.","Stability and Hopf bifurcation of a producer-scrounger model with age-structure",2016,"Advances in Difference Equations","10.1186/s13662-016-0968-2","https://www.scopus.com/inward/record.uri?eid=2-s2.0-84988564505&doi=10.1186%2fs13662-016-0968-2&partnerID=40&md5=1cdfb378269ffa4091d15e926be67a74","All Open Access, Gold"
"Brush E.R., Leonard N.E., Levin S.A.","The content and availability of information affects the evolution of social-information gathering strategies",2016,"Theoretical Ecology","10.1007/s12080-016-0301-4","https://www.scopus.com/inward/record.uri?eid=2-s2.0-84976315638&doi=10.1007%2fs12080-016-0301-4&partnerID=40&md5=8d920a334a874d428373ef1d5553b156",""
